Product ID,Sum of Stock,DOI,Product Name
2,878,4.970872259,Larutan Cap Kaki Tiga Leci 320 ml
7,24,28.38006322,Dancow Madu 3-5 Thn Advanced Excelnutri/Susu Formula 350 gram
16,18,6.285436605,Men'S Biore Acne Bright Care Gentle Facial Foam  100 gram
24,634,7.166498432,Larutan Cap Kaki Tiga Anak 200 ml
26,564,3.710203082,AQUA Air Mineral Botol 600 ml
35,45,30.04811716,Dancow Advanced Excelnutri Vanilla 1-3 Tahun Susu Formula 350 gram
36,66,7.066634017,Magiclean Wiper Fresh Mint Refill Wet Sheet 8 Sheets
55,316,8.659183959,ABC Saus Tomat 135 ml
59,20,31.4893003,Oatly Oat Milk Chocolate Dairy Free 1000 ml
64,146,0,Kardus Polos Packing Small 20x10x8cm 1 pcs
83,137,4.320414786,Cap Dua Mujair Bihun Medan 300 gram
85,235,24.18899023,Palmolive Naturals Body Wash Orchid/Sabun Mandi 1 Liter
87,370,7.411772001,Blue Diamond Almond Milk Original 946 ml
105,14,0.2962437256,Panadol Cold & Flu 1 Blister
109,480,5.190762833,Taro Net Seaweed 62 gram
112,"1,261",6.130430024,Selection Facial Cotton - Kapas  75 gram
116,238,15.31576892,Glade 3in1 Disinfectant & Air Sanitizer Clean & Fresh/Pewangi Ruangan 400 ml
121,75,4.660114741,Mazola Canola Oil 450 ml
126,48,0,Pop Mie Lapeer Kuah Kari Ayam Mie Instan Cup 75 gram
142,24,20.35309251,Hormel Spam Lite Usa 340 gram
149,30,73.92590759,KIWI Shine & Protect Black Polish 75ml 75 ml
152,8,3.228684789,Dried Shitakes Mushrooms/Jamur Shitake Kering 250 gram
153,14,4.877213467,Dancow Advanced Excelnutri Vanilla 3-5 Tahun Susu Formula 350 gram
156,268,20.29920784,Joyko Gunting Kecil SC-282 12cm 1 pcs
157,159,3.610052941,YOU-C 1000 Orange Water 500 ml
166,"1,800",35.30108265,Rinso Perfume Essence Deterjen Cair 700 ml
174,220,2.967354196,YOU-C 1000 Lemon 140 ml
178,98,11.22992762,Vanish Oxi Action Powder Tube Penghilang Noda & Kuman Pakaian 400 gram
181,218,13.27726496,Hansaplast Kain Elastis 20 Lembar 1 Pack
182,3,0.1928809522,Mylanta Sirup Obat Maag 50 ml
183,154,23.31531772,Nivea Lip Balm Essential Care 4 gram
191,74,9.85404896,Dancow Advanced Excelnutri Vanilla 5-12 Tahun Susu Formula 350 gram
199,97,12.6761559,ABC Minyak Wijen 195 ml
208,796,20.22623364,Baygon Aerosol Flower Garden/Pembasmi Serangga 600 ml
209,75,4.827941114,Strepsils Original Permen Pelega Tenggorokan 8 Butir
210,"1,099",8.34677872,Larutan Penyegar Cap Kaki Tiga 200 ml
214,33,6.254008546,Mr Muscle Pembersih Kamar Mandi 5in1 Spray/Pembersih Kamar Mandi 500 ml
225,578,5.033245492,Selection Facial Cotton Round - Kapas  1 Pack
228,166,4.10895251,Lo Han Kuo Infusion Pereda Panas Dalam 168 gram
233,48,27.87384552,"Garnier Micellar Cleansing Water All in 1 For Oily, Acne - Prone Skin 125 ml"
234,41,18.35314362,Twinings English Breakfast Tea 1 pack 50 gram
251,498,160.1510764,Men's Biore Pore Pack Black 4 Sheets
258,785,39.57182448,Pepsodent Double Care Sensitive Toothbrush 3pcs 1 Pack
259,66,8.157034445,Becom-Zet Multivitamin & Zinc Strip 10 Tablet
271,42,14.44421077,Vitalong C Vitamin C 30 Kapsul
281,90,10.72319559,OB Herbal Sirup Obat Batuk 60 ml
294,223,5.831263721,Nion-Nion Bawang Goreng Sumenep 250 gram
295,81,4.498506209,Attack Hygiene Plus Protection Deterjen Cair 750 ml
296,120,3.394244516,Kerupuk Bawang Naga Prima Warna Warni 500 gram
307,88,8.017024797,Men's Biore Cool Energy Body Foam Pouch 400 ml
331,334,13.53477864,Nivea Extra Brightening Deodorant Roll On 50 ml
340,"1,843",46.48250531,Paseo Smart Tisu Wajah 180 Sheets
356,15,3.128059576,Ny. Lily Sambal Asli Lampung 350 gram
361,641,3.464787652,Pocari Sweat Minuman Isotonik Botol 500 ml
364,17,10.48492051,Pure Paw Paw Ointment - Krim Gel Multifungsi 25 gram
392,395,14.72159104,Joyko Double Tape 12mm x 15 yard 1 pcs
399,252,0,Fermipan Ragi Instan Pengembang 44 gram
400,199,8.068616611,Joyko Double Tape 24mm x 15 yard 1 pcs
418,379,11.7383491,Hansaplast Aqua Protect 6's  1 Pack
434,6,0.3107807993,Daimaru Opp Tape Lakban Coklat 2 inch x 90 yard 1 pcs
435,402,10.38750313,Joyko Gunting SC-838 16cm 1 pcs
447,20,6.955400802,Caplang Balsem Otot Geliga 10 gram
454,108,5.849850579,YOU-C 1000 Lemon Water 500 ml
458,42,17.93055759,Twinings Earl Grey Tea 1 pack 50 gram
462,292,4.500318595,Oronamin C Drink 120 ml
463,77,58.94326025,Merries Good Skin XL16 Diapers Pants 1 Pack
473,"1,038",5.111647958,Hydro Coco Coconut Water 250 ml
484,853,10.70662675,Selection Cotton Bud Kapas 100 Stick
494,6,0.3943438288,YOU-C 1000 Apple 140 ml
506,50,4.473557676,S&B Golden Curry Medium Hot Bumbu Kari 92 gram
507,542,3.565873507,YOU-C 1000 Orange 140 ml
510,98,41.28931827,Magiclean Mop Wiper Starter Kit/Alat Pembersih Rumah 1 pcs
520,172,8.729262348,Listerine Cool Mint Antiseptic Mouthwash 500 ml
525,26,0.5209347266,Nice Embossed Tisu Toilet 10 Rolls
528,280,5.778838684,Medisoft Cotton Ball/Kapas 1 Pack
533,1,0.1970029021,Amunizer Vitamin C 1000 140 ml
547,37,7.852919297,L'Oreal Paris Conditioner Total Repair 5/Kondisioner 170 ml
551,19,7.317269134,MamyPoko Royal Soft For Girls XXL24 Pants Diapers 1 Pack
567,78,55.1344041,Durex Play Massage 2in1 Pelumas Gel - Lubricant 200 ml
569,311,2.556619358,Sasa Tepung Bumbu Serbaguna Original 210 gram
570,"2,864",28.79640319,Nestle Carnation Susu Evaporasi 405 gram
574,273,10.06776511,Listerine Cool Mint Antiseptic Mouthwash 100 ml
578,57,9.128786724,Mr Muscle Pembersih Kamar Mandi 5in1 Pouch/Pembersih Lantai 500 ml
580,66,9.645677452,Lem Aica Aibon 70 gram
584,21,13.81290882,Merries Good Skin NB-S26 Diapers Pants 1pack 1 Pack
593,45,9.947446179,Men'S Biore Bright Energy Scrub Facial Wash  100 gram
609,118,69.50631867,Biore UV Aqua Rich Watery Essence with Micro Defense SPF 50+ PA++++ 40 gram
610,205,10.11675337,Bagus Lem Ajaib Perangkap Tikus/Pembasmi Serangga 1 pcs
615,121,0,Obat Batuk Cap Ibu dan Anak 150 ml 150 ml
618,478,10.3656622,Adem Sari Ching Ku Sparkling Herbal Lemon 320 ml
622,"5,087",10.01019228,Ultra Milk Full Cream Susu UHT 200 ml
625,82,3.741657417,Tango Wafer Vanilla Pouch 99 gram
633,19,1.783590576,3M Post-It Notes Yellow 1 Pack
635,106,40.88480237,Garnier Men Oil Control Anti Shine Refreshing Foam Face Wash 100 ml
658,145,2.905502786,Nestle Koko Krunch Cereal 300 gram
662,380,25.829712,"Daimaru selotip tipis - 1/2"" x 72 yard 1 pcs"
671,"1,152",11.65834031,Bayclin Pemutih Regular Penghilang Noda Pakaian 500 ml
673,162,6.70834657,Attack Plus Softener Deterjen Cair 750 ml
676,96,8.206312945,Attack Plus Softener Deterjen Bubuk 750 gram
695,24,4.317312896,Men's Biore Scrub Deep Pore Clean Sabun Muka Pria/Sabun Cuci Muka 100 gram
701,85,14.58448299,MamyPoko X-Tra Kering NB-S44 Tape 1 Pack
703,433,173.2629213,ABC Sirup CocoPandan 460 ml
704,105,12.6547191,Minyak Kutus Kutus 100 ml
705,13,0.9922879715,Daimaru Opp Lakban Bening 24mm x 72 yard 1 pcs
709,624,2.976763924,Laurier Relax Night Wing 35cm Pembalut Wanita 12 pcs
710,358,9.190424632,Hansaplast Junior Fun Kain Elastis 10's 1 Pack
714,55,17.58956392,Magiclean Wiper Refill Tisu Kering Pembersih Lantai 20 Sheets
719,143,5.647261012,Imboost Strip Tablet Vitamin 10 Tablet
724,59,0,Pedigree Beef & Vegetable Adult Makanan Anjing 500 gram
756,494,2.08483774,AQUA Air Mineral Botol 1500 ml
757,45,16.01212167,Kaze Beras Coklat Bali Organik 1 kg
765,136,12.61762793,Daimaru Lakban Kain Hitam 48mm x 12m 1 pcs
766,199,7.018707381,Baygon Coil Jumbo Max Lavender 10 Jam/Obat Nyamuk Bakar 5 pcs
773,36,11.10303921,Bayfresh Morning Coffee Aerosol Spray/Pewangi Ruangan 320 ml
774,152,13.11400868,Herbakof Sirup Obat Batuk Herbal 60 ml
782,"2,318",161.0534159,ABC Sirup Squash Delight Jeruk Florida 450 ml
785,158,0,Nivea Men Deodorant Deep Black Charcoal Espresso Roll On 50 ml
786,63,37.72039184,Dancow Advanced Excelnutri Madu 5-12 Tahun Susu Formula 350 gram
788,107,13.90862473,Softex Maternity 45cm Pembalut Bersalin 20 pcs
792,56,0,Kaze Beras Putih Bali Organik 1 kg
793,41,48.01723593,Dancow Advanced Excelnutri Madu 1-3 Tahun Susu Formula 350 gram
811,593,11.85579351,Hansaplast Koyo Hangat Resealable  10 Sheets
813,"1,256",2.826564062,Bear Brand Susu Steril 189 ml
816,15,34.86873596,UHA Kororo Jelly Grape  40gram 40 gram
820,451,1.543807772,Diamond Full Cream Susu UHT 1000 ml
822,788,7.035441664,Maizenaku Tepung Maizena 300 gram
823,31,32.09494115,Merries Good Skin L20 Diapers Pants 1 Pack
830,510,6.375496657,Sasa Tepung Bumbu Bakwan 235 gram
833,173,8.086415802,Loacker Napolitaner Wafer 45 gram
834,77,6.646438059,Loacker Milk Wafer 45 gram
838,291,9.962818212,Cesar Lamb Dog Food 100 gram
839,236,9.355238003,Cesar Beef Wet Dog Food 100 gram
840,11,0.3935835759,CESAR Chicken & Vegetables Wet Dog Food 100 gram
844,109,7.354401027,Strepsils Vitamin C Jeruk Permen Pelega Tenggorokan 8 Butir
845,36,26.5940571,Fisherman's Friend Blackcurrant Sugar Free 25 gram
846,183,9.633951104,Fisherman's Friend Honey & Lemon Sugar Free Permen 25 gram
850,"1,596",6.85931241,Dolphin Garam 500 gram
851,21,2.816682432,Heinz Apple Cider Vinegar Cuka Apel 473 ml
853,43,1.962223687,Jolly Time Popcorn FunMania 100 gram
854,299,5.869142613,Jolly Time Popcorn The Big Cheez 100 gram
855,486,9.504146586,Jolly Time Popcorn Blast O Butter 100 gram
856,151,8.226065257,Jolly Time Popcorn Mallow Magic 125 gram
857,160,6.358764721,Arm & Hammer Pure Baking Soda 453 gram
859,117,0,Bertolli Extra Light Olive Oil 500 ml
861,91,4.943723333,Gillette Shaving Foam Krim Alat Cukur Menthol 175 gram
862,4,0.7265712715,Smucker's Preserve Strawberry Jam 340 gram
865,97,8.334896605,BRAGG Apple Cider Vinegar 473 ml
871,55,1.398130674,Lee Kum Kee Minyak Wijen 115 ml
872,141,2.155371297,Lee Kum Kee Cap Panda Saus Tiram 255 gram
873,127,2.873215765,Cap Orang Tua Misua Amoy 300 gram
874,"3,622",2.391833333,Indomie Kuah Ayam Bawang Mie Instan 69 gram
875,"9,772",6.501602098,Indomie Kuah Soto Mie Mie Instan 70 gram
876,"9,381",6.973090165,Indomie Kuah Kari Ayam Mie Instan 72 gram
877,"14,352",3.553235388,Indomie Goreng Special Mie Instan 85 gram
879,"1,080",0,Pop Mie Lapeer Kuah Ayam Mie Instan Cup 75 gram
880,164,5.569938353,Pop Mie Lapeer Kuah Baso Mie Instan Cup 75 gram
881,130,0.4324510482,Indofood Bumbu Racik Ayam Goreng 26 gram
882,46,0.6378047247,Indofood Bumbu Racik Sayur Asem 33 gram
884,45,0.3945965562,Indofood Bumbu Racik Sayur Sop 20 gram
885,98,0.672341947,Indofood Bumbu Racik Ikan Goreng 20 gram
886,"1,375",6.789588088,Chitato Potato Chips Sapi Panggang 168 gram
894,1,0.2909593654,Enfagrow A+ 3 Original 1-3 Tahun Susu Formula 400 gram
898,208,7.452607472,ABC Kecap Manis 135 ml
899,542,6.816184545,ABC Saus Sambal Extra Pedas 275 ml
900,61,0,Tropicana Slim Classic Sweetener 2.5 gr x 100 sachets 250 gram
902,62,8.08333396,Tropicana Slim Stevia Sweetener 2.5 gr x 50 sachets 130 gram
903,28,0,Tropicana Slim Honey Sweetener 2.5 gr x 50 sachets 125 gram
904,157,13.1232953,Binggrae Banana Flavored Milk Drink 200 ml
906,59,5.705283129,Oral-B Satin Floss Mint Pembersih Gigi 1 Pack
916,136,7.033863176,Nestle Milo Cereal 300 gram
917,205,15.5670041,Johnson's Milk Baby Bar Soap 75 gram
919,176,5.459496635,Oreo Double Stuff 131 gram
921,1,0.2525424333,OSK Teh Hijau Jepang Box 50 pcs 1 Pack
922,2,0.09177446775,Biore Make Up Remover Tissue Waterproof Cleansing Oil Non Alcohol 10 Sheets
930,288,21.36906815,Oral-B All Round 123 Clean Medium Toothbrush 1 Pack
931,82,6.139893017,Pantene Shampoo Silky Smooth Botol Pump/Sampo 400 ml
934,218,6.06543876,Head & Shoulder Cool Menthol Anti Dandruff Shampoo 400 ml
936,335,5.578970973,Gillette Simply Venus Basic Daisy 3 Pisau Cukur 1 Pack
938,148,6.81994246,Head & Shoulders Supreme Anti Hairfall Shampoo 135 ml
940,222,6.087191734,Oral-B All Round Fresh Clean Black Toothbrush 1 pack 1 Pack
943,201,10.41355196,Snowman Whiteboard Marker Spidol Papan Putih Black 1 pcs
946,36,30.46066491,L'Oreal Paris Extraordinary Oil Gold Hair Serum/Vitamin Rambut 100 ml
951,153,8.552380337,Durex Fetherlite Kondom 3 Sachets
952,115,27.2834457,Durex Play Feel Intimate Lube 100 ml
953,110,7.214325299,Durex Close Fit Kondom 3 Sachets
954,141,0,Durex PleasureMax Kondom Gerigi 3 Sachets
956,66,6.998305315,Lotus Biscoff Spread Smooth/Selai 400 gram
966,990,7.227239336,Laurier Super Slimguard Wing 22.5cm Pembalut Wanita 20 pcs
967,55,12.26213501,Shaoxing Arak Masak 640 ml
969,674,2.640308049,Nongshim Shin Ramyun Spicy Mushroom Mie Instan 120 gram
970,192,6.106522382,Colgate Total 12 Charcoal Deep Clean Toothpaste 150 gram
972,283,4.269677972,Totole Kaldu Jamur 400 gram
982,5,1.558869686,L'Oreal Paris Shampoo Fall Resist 3X Anti Hair-Fall/Rambut Rontok 155 ml
994,99,7.956593764,Sensi Duckbill Putih Masker Medis 3 Ply 1 Pack
997,208,6.22912013,Ovaltine Chocolate Malt Biskuit 130 gram
999,205,40.55265672,Oreo Red Velvet Biscuits 119 gram
1000,111,13.84815929,Oreo Dark & White Chocolate 119 gram
1001,228,10.36235579,Oreo Strawberry 110 gram
1002,383,0,Garnier Skin Naturals Micellar Cleansing Water 125 ml
1003,316,17.44159842,Nutella Chocolate Hazelnut Spread 350 gram
1004,142,9.983333509,Borges Extra Virgin Olive Oil 250 ml
1008,12,5.256174062,Enfagrow A+ 4 Vanilla 3-12 Tahun Susu Formula 400 gram
1009,3,1.204539889,Enfagrow A+ 3 Vanilla 1-3 Tahun Susu Formula 400 gram
1010,69,20.08296774,Enfamil A+ 2 Plain 6-12 Bulan Susu Formula Bayi 400 gram
1013,"6,373",13.07266596,Blue Band Serbaguna Margarine 200 gram
1014,513,6.447518302,Blue Band Cake & Cookie Margarine 200 gram
1017,1,0.03815948338,Chung Jung One Seaweed Olive Oil Rumput Laut 6+3 40 gram
1019,109,0,Laverland Crunch Seaweed Sea Salt Seaweed 9 pcs 40 gram
1026,34,16.25612858,Colgate Plax Peppermint Fresh Mouthwash 250 ml
1028,89,7.932707463,Johnson's Active Kids Shiny Drop Shampoo 200 ml
1030,176,7.646481083,Johnson's Baby Hair & Body Baby Bath Milk + Rice Pouch 400 ml
1032,5,0.5170343838,Clean & Clear Oil Control Film Blue/Kertas Minyak Wajah 60 Sheets
1033,27,0,Glade Automatic Spray Lavender & Vanilla Pengharum Ruangan Refill 225 ml
1034,181,26.8781904,3M Scotch-Brite Sikat Toilet Kamar Mandi Jet Scrubber ID-55/Alat Pembersih Rumah 1 pcs
1035,107,0,ChatraMue Brand Thai Tea Mix Green Tea Powder 200 gram
1036,45,10.09995665,ChatraMue Brand Thai Tea Mix Black Tea 400 gram
1037,"2,583",30.7592384,Pocky Chocolate Biskuit Stik 47 gram
1038,986,19.18176816,Pocky Strawberry Biskuit Stik 45 gram
1039,1,0.04050536856,Pocky Matcha Biskuit Stik 33 gram
1040,526,17.78051187,Pocky Cookies and Cream Biskuit Stik 40 gram
1041,21,2.625079953,MamyPoko Royal Soft NB52 Tape 1 Pack
1042,56,4.614897586,MamyPoko Royal Soft For Boys M34 Pants 1 Pack
1043,14,3.948918843,MamyPoko Royal Soft For Boys L28 Pants 1 Pack
1044,19,5.427832493,MamyPoko Royal Soft For Girls L28 Pants 1 Pack
1045,95,14.21461586,MamyPoko Royal Soft For Boys XL24 Pants 1 Pack
1046,47,2.459505918,Mamypoko Girl Royal Soft XL24 Diapers Pants 1 Pack
1047,23,8.838531595,MamyPoko Royal Soft For Boys XXL38 Pants 1 Pack
1048,15,2.715963047,MamyPoko Royal Soft For Boys & Girls S38 Pants 1 Pack
1051,68,3.223659702,Kellogg's Froot Loops Cereal 300 gram
1052,3,0.2487764704,Kellogg's Frosties/Cereal 300 gram
1055,172,8.595676362,Kellogg's Corn Flakes Cereal 500 gram
1058,14,0,Whiskas Mackerel Junior Makanan Kucing 1100 gram
1059,45,1.581128052,Whiskas Tasty Mix Seafood Cocktail Makanan Kucing Pouch 70 gram
1062,578,3.920024941,Whiskas Tuna Adult Makanan Kucing Pouch 80 gram
1063,106,2.540399283,Whiskas Mackerel Junior Makanan Kucing Pouch 80 gram
1064,198,17.18548909,Pedigree Beef & Vegetable Adult Mini Makanan Anjing 1300 gram
1065,788,10.01631588,Tao Kae Noi Big Sheet Classic Seaweed
1066,91,4.897540602,Tao Kae Noi Hot Spicy Crispy Seaweed Big Sheet 3.2gr 10 gram
1076,117,7.024636365,"Insto Regular Obat Tetes Mata Merah, Iritasi dan Berair 7.5ml"
1077,6,0.6883950344,Insto Dry Eyes Obat Tetes Mata Kering 7.5ml
1079,281,12.05854556,Bagus Kapur Ajaib Anti Kecoa & Semut/Pembasmi Serangga 12 pcs
1080,167,5.062873554,Bagus Serapair Charcoal Square Box Pewangi Ruangan 450 ml
1081,47,5.64181687,Bagus Para Kamper Kapur Barus 300 gram
1082,230,28.90192018,Bagus Para Mothballs/Kapur Barus 150 gram
1083,100,4.122073587,Bagus Anti Bau Toilet Pewangi Kamar Mandi 100 gram
1084,44,6.968393752,Bagus Serapair Square Box 700 ml
1087,48,16.80205388,Bagus Cling Wrap Box Plastik Pembungkus Plastic Wrap 30cm x 30m/Perlengkapan Dapur 1 Box
1089,80,86.83660686,Bagus Aluminum Foil Box 30cm x 7.62m 1 Box
1090,70,20.61304023,Bagus Aluminum Foil 30cm x 7.62m Refill 1 Pack
1091,403,9.957529751,Bagus Zipperbag 17cm x 15cm 30S 1 Box
1092,263,9.747507412,Bagus Zipperbag 18cm x 20cm 25S 1 Box
1093,316,48.54121036,Bagus ZipperBag Double Lock 25 x 35 cm 1 Box
1094,51,2.821793972,Bagus Zipperbag 33cm x 40cm 12S 1 Box
1095,934,15.38800069,Bagus Kantong Sampah M 65x80cm 45L Gold/White/Gray Trash Bag 10 pcs
1096,682,14.3784307,Bagus Kantong Sampah L 80x90cm 70L Gold/White/Gray Trash Bag 8 pcs
1097,576,12.44782158,Bagus Kantong Sampah XL 90x100cm 90L Gold/White/Gray Perlengkapan Dapur 6 pcs
1098,569,15.29722573,Bagus Kantong Sampah XXL 100x120cm 120L Gold/White/Gray Perlengkapan Dapur 5 pcs
1100,80,6.044843903,Pringles Saucy BBQ Potato Chips 102 gram
1101,94,8.187415969,Hinode Mirin 320 ml
1104,"2,502",0,Energizer Max Baterai AA 1 pcs
1105,505,17.80321042,Energizer Max Baterai AAA 1 pcs
1106,448,8.686573949,Nissin Lemonia Lemon Biskuit 130 gram
1107,295,7.913402107,Nissin Chocolate Wafer 110 gram
1109,125,5.237139951,Nissin Sagu Keju Cookies 110 gram
1110,438,9.151638011,Monde Serena Snack Spicy 50 gram
1111,17,6.129310214,Nissin Cheese Wafer 132 gram
1112,653,5.312263099,Monde Serena Snack Gold 60 gram
1114,966,9.714662859,Monde Pola Snack Biskuit 25 gram
1116,37,3.904902067,Monde Boromon Cookies Original Bebas Gluten Snack Bayi 100 gram
1117,7,0.6349083965,Monde Boromon Cookies Milk Bebas Gluten Snack Bayi 100 gram
1118,78,2.240537619,Gillette Vector Alat Cukur Razor/Pisau Cukur 1 pcs
1120,5,0.03535195273,La Fonte Bolognese Pasta Sauce 315 gram
1121,172,11.39828666,Salonpas Pain Relief Patch Pereda Nyeri Otot 5 Sheets
1127,271,5.551597111,Van Houten Cocoa Powder 80 gram
1128,56,2.198540298,Selamat Double Chocolate Wafer 145 gram
1129,732,8.218274754,Kapal Api Special Kopi Bubuk 150 gram
1132,73,4.005364577,Tango Royal Chocolate Wafer 99 gram
1134,797,4.607648155,Kiranti Sehat Datang Bulan Original 150 ml
1136,97,5.201710326,Tango Wafer Cokelat Pouch 99 gram
1137,234,14.07002456,Johnson's Baby Oil 125 ml
1139,87,15.21945912,Johnson's Baby Cologne Summer Swing Perawatan Bayi 100 ml
1140,171,12.97954519,Clean & Clear Foaming Face Wash Oil Free/Sabun Cuci Muka 100 ml
1142,124,11.45478496,Listerine Zero Antiseptic Mouthwash 250 ml
1143,265,5.545701836,Sasa MSG Penyedap 250 gram
1144,"3,933",14.56728195,Sasa Santan Kelapa Cair 200 ml
1147,59,9.314889153,Paperline Amplop 90 Putih Polos panjang 1 box isi 100pcs 1 Box
1148,92,21.38193874,Paperline Amplop 110 Polos Putih Polos Pendek 1 box isi 100pcs 1 Box
1151,26,1.081156213,Burung Dara Mie Kering Gandum 136 gram
1152,381,5.885862146,Burung Dara Mie Telur Urai Original 140gram 140 gram
1153,422,17.5915856,Burung Dara Mie Telur Urai Pipih 140gram 140 gram
1157,80,16.54903776,Bagus Anti Bau Mobil Pewangi Ruangan 120 gram
1158,71,6.265982379,Bagus Anti Bau Kulkas Pewangi Ruangan 120 gram
1159,17,4.898337001,Bagus Anti Bau Gel Lemari & Rak Pewangi Ruangan 180 gram
1160,12,3.280750093,Bagus Anti Bau Sepatu 4x25gr
1161,110,10.66317275,Kuldon Obat Sariawan & Panas Dalam 4 Tablet
1163,757,9.345586896,Decolgen Strip Obat Flu 4 Tablet
1164,1,0.187348351,Gatsby Styling Wax Mat & Hard/Gel Rambut 75 gram
1165,20,5.194843796,Gatsby Moving Rubber Grunge Mat/Gel Rambut 80 gram
1168,255,1.67228967,Palmia Margarin Serbaguna 200 gram
1169,167,21.32835128,Zwitsal Baby Hair Lotion Aloe Vera Kemiri/Minyak Rambut Bayi 200ml 200ml 200 ml
1171,163,1.502392113,Panadol Obat Sakit Kepala 10 Kapsul
1172,299,2.80539424,Panadol Extra 1 Blister
1173,40,4.982685913,Panadol Anak Paracetamol Cherry Tablet Kunyah Sakit Kepala & Flu Blister 10 Tablet
1175,3,0.2158861362,Sensodyne Whitening Repair & Protection Pasta Gigi Sensitif 100 gram
1176,21,2.089803122,Sensodyne Repair & Protect Extra Fresh Pasta Gigi 100 gram
1177,2,0.1486759487,Nescafe Classic Instant Botol 100 gram
1179,288,4.370913336,Nestle Carnation Susu Kental Manis Kaleng 365 gram
1180,16,3.798651267,Nescafe 3In1 Original Instant Polybag 30 Sachets 525 gram
1183,"1,637",10.82780062,Sun Kara Santan Kelapa Cair 200 ml
1185,336,11.60639529,Nissin Gekikara Ramen Hot Mushroom Mie Instan 74 gram
1186,914,0,Nissin Gekikara Ramen Hot Carbonara Mie Instan 81 gram
1187,50,1.571901885,Nissin Gekikara Ramen Hot Chicken 80 gram
1188,91,9.229954123,Gloria Abon Sapi Original 100 gram
1190,62,8.325928645,Listerine Cool Mint Antiseptic Mouthwash 250 ml
1191,4,0.3313479501,Biore Pore Pack Charcoal Pembersih Komedo 1 Pack
1192,262,11.08951664,Bamboe Bumbu Gule 35 gram
1193,"1,198",24.83013787,Bamboe Bumbu Opor 36 gram
1194,446,9.25878371,Bamboe Bumbu Rawon 54 gram
1195,103,15.19727208,Bamboe Bumbu Rendang 35 gram
1196,127,1.516077808,Bamboe Bumbu Nasi Goreng 40 gram
1197,304,7.183891657,Bamboe Bumbu Sop 49 gram
1198,602,22.44333428,Bamboe Bumbu Semur 69 gram
1199,464,19.38199331,Bamboe Bumbu Sambal Goreng Ati 54 gram
1200,187,5.456705066,Bamboe Bumbu Soto Betawi 65 gram
1201,350,4.99726779,Bamboe Bumbu Tom Yum 60 gram
1204,171,8.746430398,Bamboe Bumbu Bulgogi 80 gram
1207,790,5.323560909,Saniter Personal Wipes Sanitizer/Tissue Basah 50sheets 50 Sheets
1211,228,6.355401406,Saniter Hand Sanitizer Spray 60 ml
1212,191,14.15797654,Saniter Handwash Bottle/Sabun Cuci Tangan 250 ml
1213,691,10.32208154,Saniter Handwash Refill Pouch/Sabun Cuci Tangan 400 ml
1216,125,4.105091718,Vixal Pembersih Porselen Ekstra Kuat/Pembersih Kamar Mandi 750 ml
1217,323,36.69281014,Frisian Flag Susu Kental Manis Kaleng /Susu Krimer 370 gram
1218,203,0,Frisian Flag Bendera Kental Manis Cokelat Kaleng /Susu Krimer 370 gram
1219,556,31.44054334,Frisian Flag Full Cream Gold Susu Kental Manis Kaleng /Susu Krimer 490 gram
1220,228,94.13409386,Nice Pop Up Tisu Wajah 200 Sheets
1221,"1,249",5.346023229,Oreo Vanilla Biscuits 110 gram
1224,480,25.71508845,Ajinomoto Umami Seasoning Penyedap 250 gram
1225,4,0.3294290299,Kispray Pelicin Pewangi Pakaian Violet Bottle 318 ml
1226,53,3.05510229,Kispray Pelicin Pewangi Pakaian Gold Bottle 318 ml
1227,936,7.373316893,Kispray Pelicin Pewangi Pakaian Violet Refill 280 ml
1228,"1,151",4.484356184,Kispray Pelicin Pewangi Pakaian Gold Refill 280ml 280 ml
1229,81,1.822474843,Antis Jeruk Nipis Hand Sanitizer Spray 55 ml
1231,14,0,Glade Automatic Spray Peony & Berry Bliss Pengharum Ruangan Refill 225 ml
1233,107,4.976905559,Mr Muscle Pembersih Marmer & Granit 720 ml
1234,81,6.606338277,Glade Aerosol Ocean Escape Pengharum Ruangan 225 ml
1235,90,0,Glade Aerosol Peony & Berry Bliss Pengharum Ruangan 350 ml
1236,156,10.43119053,Mr Muscle Clear Pembersih Kaca Serbaguna Spray 500 ml
1237,124,10.41898883,Mr Muscle Toilet Cleaning Gel Refill Citrus 36ml/Pembersih Lantai 36 ml
1238,59,7.594374609,Bayfresh Sakura Bloom Reed Diffuser Regular 30ml/Pewangi Ruangan 30 ml
1239,39,6.777469532,Bayfresh Amber Lavender Reed Diffuser Regular 30ml/Pewangi Ruangan 30 ml
1246,15,7.263557121,Milna Nature Puff Organic Cheese 15 gram
1248,111,45.54844952,3M Scotch Brite Sikat Lantai Pad Kamar Mandi ID-40/Alat Pembersih Rumah 1 pcs
1250,"2,701",18.92826311,3M Scotch-Brite Sabut Spons Anti Gores Anti Bakteri Easy Clean Isi 1/Alat Pembersih 1 pcs
1253,124,10.11284616,Rohto Obat Tetes Mata Iritasi Ringan 7 ml
1254,50,4.260846096,"Rohto Cool Tetes Mata Merah, Iritasi, Berair 7 ml"
1257,2,0.02178460226,AKURAT Tes Kehamilan/Test Pack 1 Pack
1258,123,4.161687947,Sensitif Compact Test Pack 1 Pack
1261,64,2.067031619,Promag Obat Sakit Maag Tablet 1 Strips
1265,682,6.589555022,Salonpas Koyo Pereda Nyeri 10 Sheets
1269,"1,077",39.48250311,Nutrijell Leci Sachet 15 gram
1270,343,7.035807023,Nutrijell Jelly Powder Plain 15 gram
1271,"2,183",72.1132929,Nutrijell Jelly Powder Cincau 15 gram
1272,722,27.44282165,Nutrijell Cokelat Sachet 30 gram
1273,"3,062",90.00608774,Nutrijell Jelly Powder Kelapa Muda 15 gram
1277,"2,895",23.16977905,Softex Celana Menstruasi M-L Pembalut Wanita 2 pcs
1278,123,1.839236063,Koepoe Koepoe Lada Putih Bubuk 85 gram
1280,106,11.45729059,Koepoe Koepoe Biji Selasih 50 gram
1281,198,3.184567326,Koepoe Koepoe Baking Powder 45 gram
1282,238,4.635906103,Koepoe Koepoe Soda Kue 81 gram
1283,52,30.32416239,Koepoe Koepoe Rhum Jamaica 60 ml
1284,107,3.472407482,Koepoe Koepoe Perisa Vanilla 20 gram
1285,30,3.127948091,Koepoe Koepoe Pasta Pandan 60 ml
1286,203,0,Dua Belibis Saus Cabe Sachet 24 Sachets
1292,33,10.02967998,Caladine Baby Liquid Powder Perawatan Bayi 100 gram
1297,111,3.097954629,Paseo Elegant Tisu Toilet 8 Rolls
1298,402,2.408221164,Paseo Calorie Absorb Tisu Dapur 3 Rolls
1299,226,3.202870598,[Buy 1 Get 1] Paseo Wipes Anti Bacterial/Wet Tisue 25 Sheets
1301,27,0.3102335362,Rose Brand Tepung Beras 500 gram
1302,683,22.2172012,Rose Brand Minyak Goreng Pouch 2 Liter
1303,"6,566",89.04362774,Rose Brand Gula Premium Hijau 1 kg
1304,849,8.516312686,Rose Brand Gula Kuning/Gula Pasir 1 kg
1305,8,0.2306894525,OBH Combi Menthol Obat Batuk Berdahak Sirup 100 ml
1310,8,8.563332061,Wardah EyeXpert Optimum Hi-Black Liner 1 gram
1316,104,3.665017709,Cap Lang Minyak Kayu Putih 120 ml
1317,66,21.45334974,Caplang Balsem Lang 20 gram
1318,222,8.112688032,Norit Karbon Aktif Obat Diare 40 Tablet
1320,33,0.9709632943,Charm Safe Night Wing 29cm Pembalut Wanita 18 pcs
1321,208,2.847529716,Charm Body Fit Extra Maxi Wing 23cm Pembalut Wanita 28 pcs
1322,200,35.41415069,Mamypoko Pants X-tra Kering S38 Diapers 1 Pack
1323,152,55.5100248,MamyPoko X-Tra Kering M32 Pants 1 Pack
1324,194,57.05144756,MamyPoko X-Tra Kering L28 Pants Diapers 1 Pack
