Product ID,Sum of Stock,DOI,Product Name
11269,37,3.100257162,SoKlin Bio Matic + Softener Front & Top Fresh Scent Deterjen Cair 700 ml
11271,48,31.25754767,SoKlin Liquid White & Bright Deterjen Cair 1 Liter
11275,110,6.283192295,SoKlin Liquid Anti Bacterial Deterjen Cair 720 ml
11278,24,3.458065056,SoKlin Bio Matic + Softener Front & Top Nature Scent Deterjen Cair 700 ml
11279,37,2.987644332,SoKlin Liquid Scarlett Blossom Deterjen Cair 720 ml
11282,51,35.18394101,SoKlin Liquid Violet Blossom Deterjen Cair 1 Liter
11315,602,7.46774294,Sosro Tehbotol Less Sugar 350 ml
11350,36,307.5105055,Cavendish & Harvey Cola Drops 175gram 175 gram
11351,65,202.3894737,Cavendish & Harvey Mix Fruit Sugar Free 175gr 175 gram
11352,30,167.4844035,Cavendish & Harvey Mixed Fruit Drop 175gram 175 gram
11353,31,192.7314256,Cavendish & Harvey Pinkgrrape Fruit Drops 200gr 175 gram
11368,9,0.2356047813,Maicih Basreng Pedas 100gram 100 gram
11371,42,16.08673007,Maicih Kripik Singkong Level 5 80 gram
11385,29,4.934888503,Mama Lime Green Tea Pouch 430 ml
11392,25,43.68312334,Mama Mie Kuah Shrimp Tom Yum Mie Instan 90 gram
11396,68,7.001918509,Mama Lemon Lemon + Daun Mint Cairan Pencuci Piring Pouch 430 ml
11397,35,22.72376489,Mama Lime Lime + Mineral Salt Cairan Pencuci Piring Botol
11398,25,5.353159844,Mama Lime Lime + Mineral Salt Cairan Pencuci Piring Botol 750 ml
11399,144,8.539697873,Mama Lime Charcoal Cairan Pencuci Piring 680 ml
11401,388,21.58141579,Mamasuka Bumbu Instan Ayam Goreng 35 gram
11405,190,10.94651075,Mamasuka Bumbu Soto Ayam 20 gram
11408,7,9.244511935,Mamasuka Corn Oil/Minyak Jagung 900 ml
11409,13,35.48180275,Mamasuka Delisaos Arrabbiata/Saus Pasta 315 gram
11410,44,3.079663108,Mamasuka Delisaos Bolognese/Saus Pasta 315 gram
11414,10,23.10641879,Mamasuka Delisaos Saus Bulgogi 320 ml
11418,15,13.08027543,Mamasuka Delisaos Saus Teriyaki 320ml 320 ml
11420,2,3.285130029,Mamasuka Soto Kudus 50 gram
11422,7,0.8636777333,Mamasuka Sup Krim Jagung/Cream Soup 55 gram
11424,69,16.32816571,Mamasuka Sup Krim Jamur/Cream Soup 55 gram
11425,15,1.478805187,Mamasuka Tepung Bumbu Ayam Goreng Ala Korea Original 170 gram
11427,7,1.484056184,MamyPoko Royal Soft Boy XL46 Diapers Pants 1 Pack
11429,9,0.6395491213,MamyPoko Royal Soft L52 Pants 1 Pack
11433,13,2.481617203,MamyPoko Royal Soft For Boys & Girls S70 Pants 1 Pack
11434,36,13.51043075,MamyPoko X-Tra Kering L42 Pants 1 Pack
11436,62,22.20553221,MamyPoko X-Tra Kering M48 Pants 1 Pack
11439,56,14.49895536,MamyPoko X-Tra Kering XL38 Pants 1 Pack
11441,270,23.67408305,MamyPoko X-Tra Kering Tidak Gembung L28 Diapers Pants 1 Pack
11442,118,26.04790178,MamyPoko Tidak Gembung Slim M30 Pants 1 Pack
11445,50,10.00492452,Masako Bumbu Kaldu Ayam Penyedap 100 gram
11446,70,7.759092002,Masako Bumbu Penyedap Ayam 130 gram
11447,49,63.57528414,Masako Ayam/Penyedap 500 gram
11460,5,3.403997894,Master Kids Shampoo Superman 150 ml
11467,200,7.816544415,Mayasi Kuaci Bawang Kacang Jepang 65 gram
11472,160,46.79628378,Mayumi Pedas Sachet/Mayonaise 100 gram
11473,281,36.80400084,Mayumi Sachet/Mayonaise 100 gram
11480,64,5.047107652,Me-O Seafood Adult Makanan Kucing Canned 400 gram
11482,19,1.201253078,Me-O Dry Adult Salmon Makanan Kucing 1100 gram
11487,1,0.3749973808,Me-O Creamy Treats Crab Snacks Kucing 60 gram
11488,46,5.854627444,Me-O Kitten Food Ocean Fish Flavor 400 gram
11505,31,31.33092346,Merbabu Bihun 250 gram
11507,21,7.822239595,Merries Good Skin L42 Diapers Pants 1pack 1 Pack
11509,102,40.46013952,Merries Good Skin M48 Diapers Pants 1pack 1 Pack
11511,36,4.234004375,Merries Good Skin XL30 Diapers Pants 1 Pack
11515,117,108.6771417,Arirang Mie Goreng Rasa Ayam Mie Instan 130 gram
11528,16,5.10533463,Milna Bubur Bayi 6+ Tim Hati Ayam 120 gram
11529,45,14.35875365,Milna Bubur Bayi 8+ Daging Kacang Polong 100 gram
11539,22,10.65321711,Milna Wgain Bubur Bayi Ayam Bayam 120 gram
11540,166,5.868468365,Milo 3In1 Activ-Go Polybag 340gr 10 Sachets
11542,45,75.18603278,Milo 3In1 Pouch 800 gram
11544,18,23.69396014,Milo Actigen-E Pouch 990gr 990 gram
11545,47,76.05319429,Milo Actigen-E Pouch 800 gram
11547,31,6.869701822,Milo Activ-Go UHT Multipack 180ml x 4
11549,40,12.09499899,Milo Sereal Sarapan Cup  32gram 32 gram
11558,3,146.3716371,Miratone Conditioning Cream Color 6Ma Mahogany (Renew) 1box 1 Box
11560,119,4.962451852,Pembersih Lantai Fresh Apple 1000ml - Astro Basics/Pembersih Lantai 1 Liter
11565,1,2.867054636,Miwon/Penyedap 500 gr 500 gram
11568,79,12.68782017,Merries Good Skin XXL28 Diapers Pants 1 Pack
11574,191,6.135123169,Mitu Baby Ganti Popok Wipes Lovely Vanilla Buy 1 Get 1 Tisu Basah 50 Sheets
11581,64,5.025219999,Mitu Baby Fresh & Clean Wipes Blossom Berry Buy 1 Get 1 Tisu Basah Travel Pack
11582,35,0,Tawon Minyak Goreng 1 Liter
11584,132,4.962370985,SoKlin Pemutih Penghilang Noda Pakaian 1 Liter
11585,7,2.900604852,SoKlin Pemutih Pakaian Botol 220 ml
11589,59,6.862685053,SoKlin Comfort Blue Pewangi Pakaian 1700 ml
11590,45,5.437541119,SoKlin Pewangi Comfort Blue Pelicin Pelembut Pakaian 800 ml
11591,122,3.902426162,SoKlin Energetic Red Pewangi Pakaian 800 ml
11592,35,3.613227957,SoKlin Pewangi Pakaian Exotic Purple 800 ml
11594,21,7.588097943,SoKlin Hijab Refreshing Green Pewangi Pakaian 1700 ml
11595,416,8.846875581,SoKlin Pewangi Pakaian Romantic Pink 1700 ml
11596,44,6.330805961,SoKlin Romantic Pink Pewangi Pakaian 800 ml
11597,42,13.85062785,SoKlin Exotic Purple Pewangi Pakaian 1700 ml
11598,18,1.662387228,SoKlin Softergent Velvet Orchid Deterjen Bubuk 720 gram
11599,21,8.058545356,SoKlin Antisep Anti Kuman Deterjen Bubuk 700 gram
11600,51,16.24658444,SoKlin Softergent Magniloa & Berries Deterjen Bubuk 720 gram
11602,41,8.857329196,Soklin Royale Pelembut Pakaian Sunny Day 720 ml
11603,148,6.773266214,Royale Sweet Floral Pewangi Pelembut Pakaian 680 ml
11606,37,1.531071606,SoKlin Softener Blue 1x Bilas Pelembut dan Pewangi Pakaian Konsentrat 720 ml
11608,19,3.957580189,SoKlin Softener Twilight Flowery Blue Pelembut Pakaian 650 ml
11609,23,5.569474738,SoKlin Softener Twilight Glamorous Purple Pelembut Pakaian Pouch 650 ml
11611,60,3.475471252,SoKlin Softener Starry New York Pelembut dan Pengharum Pakaian 1800 ml
11614,10,0.6412026607,SoKlin Softener Fine Pelembut Pakaian Konsentrat 650 ml 650 ml
11616,52,3.756499094,SoKlin Softener Love In Paris Pelembut dan Pengharum Pakaian 1800 ml
11618,49,3.98585751,SoKlin Softener Mystical Tokyo Pelembut dan Pengharum Pakaian 1800 ml
11619,24,1.298835877,SoKlin Softener Mystical Tokyo Pelembut dan Pengharum Pakaian 900 ml
11620,48,86.49116903,SoKlin Softergent Korean Camellia Deterjen Bubuk 720 gram
11646,24,11.6699172,SOS Karbol Classic Pine Botol/Pembersih Lantai 3600 ml
11648,2,0.9724931002,SOS Karbol Sereh Lemon Pembersih Lantai 4 Liter
11651,41,34.53692613,SOS Pembersih Lantai Lemon Refill 725ml/Pembersih Lantai
11667,28,13.5262052,SOS Lemon Fresh Ginger Cairan Pencuci Piring 575 ml
11669,"2,157",7.006072789,So Soft Freesia & Pear Deterjen Cair 700 ml
11670,43,13.61853376,So Soft Deterjen Cair Rose & Waterlily Pouch 700 ml
11672,4,0.3668055497,Sovia Minyak Goreng Pouch/Cooking Oil 1 Liter
11673,13,0.4061816603,Sovia Minyak Goreng Pouch/Cooking Oil 2 Liter
11677,78,14.15521598,Sprite Botol 250 ml
11690,15,14.45447867,Stella Aerosol Apple Fiesta Pengharum Ruangan 200 ml
11698,3,0,Stella Aerosol Orange Twist Pengharum Ruangan 350 ml
11704,45,75.8282806,Stella All In One Lemon Splash/Pewangi Ruangan 42 gram
11705,5,6.859933743,Stella All In One Orange Zest/Pewangi Ruangan 42 gram
11717,13,25.7228476,Stella Daily Freshness Green Fresh 7ml/Pewangi Ruangan 7ml 7 ml
11721,35,607.4642311,Stella Daily Freshness Vanilla/Pengharum Ruangan 7 ml
11726,32,21.07213149,Stella Matic Device Pengharum Ruangan 1 Pack
11731,25,12.04539889,Stella Matic Refill Orange Twist Refill 160 ml
11737,120,12.12509822,Stella Matic Green Fantasy Pengharum Ruangan Refill 160 ml
11740,41,19.75445419,Stella Matic Refill Wild Flower Refill 160 ml
11741,12,0,Stella Perfum'ist Mini Matic Device Pengharum Ruangan 1 pcs
11743,3,0.4829951635,Stella Perfum'ist Mini Matic Green Fantasy Pengharum Ruangan Refill 40 ml
11745,498,6.855552741,Stella Pocket Bathroom Blue Freesia Pengharum Ruangan 10 gram
11746,827,37.0714706,Stella Pocket Bathroom Orange Sunkist Pengharum Ruangan 10 gram
11747,673,11.37761888,Stella Pocket Bathroom Purple Lily Pengharum Ruangan 10 gram
11748,362,6.292851237,Pantene Conditioner Miracles Biotin Strength 150 ml
11749,328,6.975971124,Mamypoko Regular Wipes Non Fragrance Buy 1 Get 1 Tisu Basah 1 Pack
11750,34,16.45524909,MamyPoko Wipes Regular Antiseptik Non Perfume 48sheets 48 Sheets
11751,13,1.23887723,MamyPoko Wipes Tisu Basah Hand & Mouth 2 x 50 NonPerfume 1 Pack
11752,276,1.480559641,AQUA Air Mineral Dus 330ml 24 Bottles
11758,5,0.8673223736,Lifebuoy Sabun Batang Total 10 Isi 4/Bar Soap 100 gram
11759,15,7.259668715,Lifree Popok Celana Extra Serap Hijau L16 1 Pack
11760,4,1.935911657,Lifree Popok Celana Extra Serap Hijau M20 1 Pack
11768,71,0,Lungkow Soun 250 gram
11773,70,6.208915843,Mama Lime Lime + Mineral Salt Cairan Pencuci Piring Pouch 1500 ml
11779,633,12.94998257,Molto Pure Soft & Gentle Softener Konsentrat 1600 ml
11783,161,11.52384255,Molto Active Fresh Pewangi & Pelembut Pakaian 1700 ml
11784,189,9.509715686,Molto Active Fresh Pelembut & Pewangi Pakaian 765 ml
11785,72,11.15626077,Molto Pewangi Flower Shower 1.7L/Pewangi Pelembut Pakaian
11786,109,10.08040081,Molto Pewangi Soft & Fresh Pelembut Pakaian 765 ml
11789,123,0,Molto Pewangi Sport Fresh Pelembut Pakaian 1700 ml
11793,60,177.6688091,Monde Milk Marie 225 gram
11795,67,4.520724981,Monde Genji Original Mini Pie 50 gram
11800,18,195.9316245,Monsters Muesli Multi Grain Porrigde 700 gram
11803,118,11.25398583,Morin Blueberry Jam Botol 170 gram
11812,5,1.135792773,Munik Bumbu Ayam Panggang 150gram 150 gram
11813,13,2.163043391,Munik Bumbu Gulai Ayam 100gram 100 gram
11814,16,54.90979863,Munik Bumbu Gulai Kepala Ikan 105gram 105 gram
11815,15,3.517403184,Munik Bumbu Kuah Baso 58 gram
11818,20,27.97361986,Munik Bumbu Nasi Uduk 34 gram
11819,31,4.128361786,Munik Bumbu Opor Ayam Munik 65 gram
11820,37,28.12826798,Munik Bumbu Rawon 125 gram
11821,27,9.759632608,Munik Bumbu Sambal Goreng Kentang Udang 140 gram
11837,21,50.86224452,My Baby Hair & Body Wash Aloe & Avocado 200 ml
11838,24,111.9670416,My Baby Hair & Body Wash Sweet Floral Refill 400 ml
11866,73,79.65666542,Natur E Active Beauty Natural Vitamin E 300 Iu 16 Kapsul
11867,54,18.04427036,Natur E Act Beauty Nat VitaminE300IU 32 Kapsul
11871,153,4.894012919,Nestle Milo Balls Cereal 150 gram
11877,29,18.8584785,Nice Bathroom Tissue White 238'S x 10/Tisu Kamar Mandi
11879,40,1.523808629,Nice Facial Tissue Kiloan 700gr/Tisu Wajah 700gram 700 gram
11880,6,0,Nice Facial Tissue Kiloan 1000gr/Tisu Wajah
11882,116,2.847962505,Nice Softpack Multipack 200sheets (Buy1G1)/Tisu
11883,11,12.7255462,Nice Towel Single Roll/Tisu Handuk 150 Sheets
11885,108,0,Nice Multipurpose Towel Tisu 160 Sheets
11896,47,183.6336196,Nissin Gekikara Ramen Kuah Hot Spicy Mie Instan 109 gram
11928,126,8.527903799,Nutrijell Pudding Belgian Chocolate 130 gram
11930,143,0,Nutrijell Pudding Pandan 130 gram
11932,125,22.92436404,Nutrijell Pudding Karamel 142 gram
11934,360,14.21619076,Nutrijell Jelly Powder Anggur 15 gram
11935,302,53.28199757,Nutrijell Jelly Powder Jambu 15 gram
11937,280,273.8672586,Nutrijell Jelly Powder Melon 15 gram
11938,94,9.166277051,Nutrijell Jelly Powder Orange 15 gram
11939,71,23.17387605,Nutrijell Jelly Powder Strawberry 15 gram
11943,"1,336",10.08338504,Rose Brand Santan Kelapa Cair 65 ml
11952,9,5.841123625,Saori Saus Teriyaki 275ml 275 ml
11953,"1,549",31.0700869,Saori Saus Teriyaki Botol 135 ml
11954,280,15.75786582,Saori Saus Teriyaki Sachet 22 ml
11955,227,16.46747939,Saori Saus Tiram Botol 1 Liter
11956,205,24.18410399,Saori Saus Tiram Botol 133 ml
11957,462,31.28762654,Saori Saus Tiram Sachet 23 ml
11958,57,3.637199714,Sasa Msg 100 gram
11961,26,32.88874442,Sasa Kaldu Pelezat Rasa Sapi 250 gram
11963,122,20.96903766,Sasa Saus Sambal Asli 135 ml
11964,43,94.32716861,Sasa Saus Sambal Asli Sachet 950 gram
11967,545,20.9149073,Sasa Saus Sambal Asli Sachet 8gr 24 pcs
11968,166,23.56326718,Sasa Saus Sambal Ekstra Pedas 135 ml
11969,127,0,Sasa Saus Sambal Ekstra Pedas Sachet 8gr 24 pcs
11971,92,21.1311405,Sasa Saus Tomat 340 ml
11977,300,0,#N/A
12006,332,8.685681543,Anak Raja Super Kepala Beras Premium 3 kg
12008,176,10.87579884,Angel Ragi Instant Box 11gr 4 pcs
12019,19,8.130018709,Anlene Actifit 3X Cokelat Susu Bubuk Dewasa 580 gram
12020,44,60.34770122,Anlene Actifit 3X Cokelat Susu Bubuk Dewasa 240 gram
12021,79,33.62592536,Anlene Gold 5X Cokelat Susu Bubuk Dewasa 600 gram
12022,22,12.0689921,Anlene Gold 5X Original Susu Bubuk Dewasa 850 gram
12053,400,0,#N/A
12054,56,0,#N/A
12055,139,3.865795517,Oishi Kraker Udang Pedas 70 gram
12061,3,3.000047214,Oisihi Panchos Jagung Pedas 160 gram
12062,99,4.225128964,Oishi Panchos Keju Nacho Tortilla Chips 145 gram
12064,60,1.67352398,Oishi Pillow Chocolate 100 gram
12066,101,2.489234937,Oishi Pillow Ubi 100 gram
12067,34,5.143239863,Oishi Popcorn Cokelat 100 gram
12068,4,0.2367797693,Oishi Poppy Pop Jagung Bakar 60 gram
12074,156,5.873163484,Oishi Suky Suky Udang Manis Pedas 60 gram
12091,27,5465.262106,Olay Total Effects Normal cream SPF 15 12gram 12 gram
12101,23,12.6022069,Old Town 3In1 Classic Sachet 15 x 40gr 600 gram
12123,214,2.741107422,Laurier Healthy Skin Day Wing 25cm Pembalut Wanita 14 pcs
12124,101,6.082926441,Laurier Pantyliner Cleanfresh Non Parfumed 40 pcs
12125,20,1.947650816,Laurier Pantyliner Parfumed 40pcs 1pack 1 Pack
12129,22,10.59995102,Laurier Relax Night Wing 35cm x 18pcs 1pack 1 Pack
12131,6,0.6939217229,Laurier Relax Night Wing 30cm 8pcs 1 Pack
12132,17,2.57856778,Laurier Super Care Relax Night 35cm x 6pcs 1pack 1 Pack
12133,68,4.496729924,Laurier Relax Night Gather Wing 35cm Pembalut Wanita 16 pcs
12134,75,48.18991428,Laurier Super Guard X-Tra 35cm x 8pcs 1pack 1 Pack
12136,353,4.535494196,Laurier Super Slimguard Wing 35cm Pembalut Wanita 12 pcs
12137,72,34.69074881,Laurier Active Day X-Tra Maxi 22cm 30pcs 30 pcs
12139,93,6.731190219,Laurier Active Day X-Tra Maxi Wing 20pcs 1pack 1 Pack
12140,33,21.64976462,Laurier Super Maxi 10pcs 1pack 1pack 1 Pack
12141,32,12.93053437,Laurier Super Maxi 20pcs 1pack 1 Pack
12147,302,9.67572301,Lee Kum Kee Panda Oyster Sauce 145 gram
12148,32,2.18278668,Lee Kum Kee Soy Sauce Dark Premium 500ml 500 ml
12149,15,0,Lee Kum Kee Soy Sauce Premium 500 ml
12156,105,10.35252502,Laurier Healthy Skin 22 New 20pcs 1pack 1 Pack
12157,10,0.7887779474,Laurier Healthy Skin Day 22cm x 18pcs 1pack 1 Pack
12158,170,2.648724054,Laurier Healthy Skin Night Wing 35cm Pembalut Wanita 6 pcs
12161,31,14.93629463,Laurier Relax Night Wing 30cm x 24pcs 1pack 1 Pack
12162,17,1.103241073,Laurier Relax Night With Gather 40cm x 8pcs 1pack 1 Pack
12176,142,27.66079634,Leivy Naturally Double Moisturising Shower Cream Pouch 450 ml
12177,131,15.13428887,Leivy Naturally Double Moisturising Shower Cream Pouch 900 ml
12178,662,4.589383636,Cap Gajah Lem Perangkap Tikus dan Hama/Pembasmi Serangga 60 gram
12191,137,12.5620421,Lexus Cheese Family Pack Biscuits 190 gram
12192,22,25.60411546,Lexus Choco Coated 200gr 200gram 200 gram
12201,17,7.707847161,Lifebuoy Cool Fresh Antibacterial Body Wash Refill 250 ml
12202,20,13.115751,Lifebuoy Mild Care Antibacterial Body Wash 240 ml
12203,19,6.00272418,Lifebuoy Total 10 Antibacterial Body Wash 240 ml
12205,15,17.80580732,Lifebuoy Shampoo Anti Dandruff 680 ml
12212,84,31.62916999,Lifree Pad Penghemat Popok Refill 18 pcs
12216,34,11.5150183,Lifree Popok Perekat M8 1 Pack
12217,16,6.730575413,Lifree Popok Perekat XL6 1 Pack
12220,1,48.79054571,Linco Adult Diapers M8 1 Pack
12224,9,23.54544708,Lindsay Ripe Pitted Olives Medium 170 gram
12241,51,725.5722423,Listerine Mouthwash Zero 500 ml
12259,31,7.927131102,Loacker Quadratini Napolitaner Wafer 250 gram
12267,13,21.12007502,L'Oreal Elseve Shampoo Color Protect 280 ml
12269,4,8.043064309,L'Oreal Elseve Shampoo Fall Resist 3X 280 ml
12329,7,17.42928632,Pepero Biskuit Stik Choco Cookie 47 gram
12389,225,1580.352386,Emeron Lovely Natural Hand and Body Lotion Sakura 100ml 100 ml
12415,14,30.07693942,Oral B Mouthwash Pro Health Refresh Mint/Obat Kumur
12424,88,40.23470931,Colgate Pasta Gigi Barbie Bubble Fruit 40gram 40 gram
12435,41,21.01010163,Garnier Clean Micellar Biphase 125ml/Micellar Oil 125 ml
12441,6,8.758446174,Garnier Man Facial Foam Acno Fight Wasabi 100ml 100ml 100 ml
12442,39,56.12481853,Garnier Men Turbo Bright Super Duo Foam Fash Wash 1tubes 1 Tubes
12445,26,22.6232145,Garnier Micellar Water Pink 50ml 50 ml
12449,1,50.99966559,Garnier Men Oil Control Anti-Shine Refreshing Foam Facial Wash 50 ml
12450,1,119.8675747,Garnier Men Oil Control Anti-Blackheads Icy Scrub Facial Wash 50 ml
12451,33,14.64485275,Garnier Micellar Clean Water Yellow 125ml 125 ml
12452,33,9.654261384,Garnier Rose Normal to Dry Skin Micellar Water 125 ml
12455,17,8.037826012,Garnier Pure Active Multi Action Scrub 100ml 100ml 100 ml
12462,12,16.67713767,Gillete Blue3 Brother Disposable Ice 2 pcs
12464,35,0,[INVALID] Gillete Mach 3 Carton 4S 1 Pack 1 Pack
12467,157,17.23803067,Gillette Blue II 2 Pivot 2S 1 Pack
12470,13,17.98504158,Gillette Blue 3 Comfort/Alat Cukur 2 pcs
12476,24,8.618324443,Gillette Simply Venus Basic Alat Cukur Wanita 2pcs 1pack 1 Pack
12479,51,233.6912424,Gillette Fusion Proglide Base Card Refill Alat Cukur isi 4 1 Pack
12486,26,110.4357133,Gillette London Bridge Silet Cukur 1 Pack
12487,216,539.241475,Gillette Mach 3 Turbo Blades Isi 2 1 Pack
12488,2,4.202179489,Gillette Mach 3 Turbo Razor 1 Pack
12490,9,5.420562647,Gillette Venus Alat Cukur Wanita Simply 3 Venus Isi 4 pcs 1 Pack
12493,130,5.846068008,Oreo Chocolate Creme Biscuits 119 gram
12496,407,4.236516346,Oreo Mini Vanilla 61 gram
12501,333,19.19372137,Oreo Dessert Treats Neapolitan Biscuits 393 gram
12508,175,4.185889857,Oral-B All Round 123 Clean Soft Toothbrush 1 packs 1 Pack
12513,15,0,Oral-B Ultra Thin Black Tea Sikat Gigi 3 pcs
12515,33,20.39978025,Oral-B Ultra Thin Green Tea Sikat Gigi 3 pcs
12553,39,0,Oskadon Obat Sakit Kepala 4 Tablet
12554,30,19.51338524,Oskadon Sp 4 tablet/Obat Sakit Kepala 4tablet 4tablet 4 Tablet
12557,97,101.2388564,Oto Adult Diapers L14S 800gram 800 gram
12562,14,4.773068048,Oto Adult Diapers Pants Xl12 800 gram
12573,96,42.90062232,Garnier Men Shampoo Color 1.0 Pack 1pack 1 Pack
12587,27,63.50668295,Ottogi Cooking Wine 360 ml
12606,47,59.5699421,Ottogi Sesame Ramen 115 gram
12621,"1,324",0,FS Beras Melati Sentra Ramos 5 kg
12622,95,3.202066115,Sania Beras Premium 5 kg
12624,1,12.01506293,Stimuno Syrup Tuty Fruity 60 ml
12638,29,44.09497114,Sukro Kacang Kedele 100gram 100 gram
12639,6,10.26005427,Sukro Kacang Kribo 100gram 100 gram
12640,345,0,Sukro Kacang Original 100 gram
12641,62,29.94352682,Sukro Kacang Oven Pedas 100gram 100 gram
12644,80,5.116672686,Suksess Mie Goreng Ayam Kremes Mie Instan 112 gram
12668,43,46.51993071,SUN Bubur Sereal Ekonomis Kacang Hijau  120 gram
12680,530,0,Sunco Minyak Goreng Botol 1 Liter
12681,913,3.372637397,Sunco Minyak Goreng Pouch 1 Liter
12683,27,17.1176708,Sunkist Dry Roast Pistachios 454 gram
12688,38,56.84447145,Sunkist Pistachios Hot & Spicy 150 gram
12690,15,15.56016911,Sunkist Pistachios Salt & Pepper 120 gram
12691,80,10.40383901,Sunlight Mandarin Orange Cairan Pencuci Piring Pouch 600 ml
12698,293,1.652386177,Sunlight Jeruk Nipis Cairan Pencuci Piring Refill 1500 gram
12711,65,19.38178483,Sunsilk Conditioner Soft And Smooth 160 ml
12716,52,14.12323504,Sunsilk Hijab Shampoo Refresh 300 ml
12717,23,2.744087095,Sunsilk Shampoo Black Shine 650 ml
12725,44,22.52237806,Sunsilk Soft & Smooth Shampoo 650 ml
12736,104,4.707102478,Super Pell Fresh Apple Pembersih Lantai 1600 ml
12743,1,0,Supermi Kuah Ayam Bawang Mie Instan 75 gram
12745,56,14.18663655,Super O2/Air Mineral 385 ml
12748,4,3.887080823,Supersol Botol/Pembersih Lantai 900 ml
12750,40,3.574452731,Supersol Karbol Wangi Pembersih Lantai Pine 750 ml
12754,25,18.93069701,Supersol Pembersih Lantai Karbol Pine 430ml 430ml 430 ml
12755,3,1.422293665,Supersol Karbol Sereh Pouch 750 ml
12802,20,23.24545827,Swallow Deodorizer Lime Pewangi Ruangan 80 gram
12804,84,151.6517586,Swallow Floral Fresh/Pewangi Ruangan 6 pcs
12805,114,113.661076,Swallow Fruit Fresh/Pewangi Ruangan 6 pcs
12813,62,5.723811797,Swallow Toilet Colour Ball/Pewangi Ruangan 3 pcs
12814,390,8.311375396,Swallow Toilet Colour Ball Pewangi Toilet 5 pcs
12821,39,86.08431295,Swan Naphthalene Color Ball Pewangi Ruangan 5 pcs
12830,3,46.83263527,Sweety Bronze Pants Dry X-pert XXL24 1 Pack
12832,13,0.4734236322,Systema Nano Menthol Breeze Toothpaste  190 gram
12835,8,5.254708959,Systema Pasta Gigi Sensitive White 105 gram
12837,12,5.166454702,Systema Pasta Gigi Spring Fresh 190gram 190 gram
12862,75,8.354943348,Tao Kae Noi Crispy Tom Yum Seaweed 32 gram
12864,113,10.44002018,Tao Kae Noi Tempura Original Seaweed 32 gram
12867,57,5.322946941,Tao Kae Noi Tempura Spicy Seaweed 32 gram
12878,"3,780",148.0694703,Teh Botol Sosro Original 250 ml
12892,741,10.9172937,Ultrajaya Teh Kotak Rasa Apel 300 ml
12893,971,11.92224879,Ultrajaya Teh Kotak Rasa Blackcurrant 300 ml
12894,255,9.416136779,Ultrajaya Teh Kotak Jasmine 500 ml
12895,2,0.02985406761,Ultrajaya Teh Kotak Rasa Lemon 300 ml
12896,"2,000",7.969381781,Ultrajaya Teh Kotak Jasmine Less Sugar 300 ml
12900,7,0.8850897771,Tehbotol Sosro Original 200 ml
12910,22,0,#N/A
12914,377,10.31995187,Sania Tepung Terigu 1kg 1 kg
12923,3,2.049803369,Ovale Facial Lotion Whitening 200 ml
12934,176,23.13199044,Ovaltine Uht /Susu UHT 200ml 200ml 200 ml
12935,43,5.08695456,Ovaltine Choco Malt Susu UHT 1000 ml
12936,41,19.90326212,Ovomaltine Crunchy Cream Chocolate Spread Botol 680 gram
12939,11,367.2233013,Bukrim Oxyklin Detergent Romantic Floral 800 gram/Deterjen Bubuk 800 gram
12940,101,86.67868897,Oyster Brand Fish Sauce 200 ml
12965,174,27.38427829,Palmolive Naturals Milk & Wild Orchid Shower Milk 400 ml
12970,226,20.57961971,Palmolive Aroma Sensations Morning Tonic Shower Gel Refill 450 ml
13086,44,4.372003383,Pantene Conditioner Hair Fall Control 290 ml
13090,369,10.44183293,Pantene Conditioner Miracles Collagen Repair 150 ml
13091,46,3.353545837,Pantene Conditioner Miracles Keratin Glow 150 ml
13110,249,34.76703956,Lux Botanicals Bright Bluebell Brightening Body Wash Pouch 800 ml
13117,28,18.62141595,Lux Botanicals Soft Rose Body Wash Refill 240 ml
13121,62,50.57210151,Lux Botanical Soft Rose Body Wash Refill 400 ml
13123,5,23.94842741,Lysorin pouch/Pembersih Lantai 630ml 630 ml
13186,8,2.119460875,Mamasuka Mayonaise 100 gram
13193,32,15.48415127,Mamasuka Rumput Laut Jagung Bakar 4.5gr x 2pcs 9gram 9 gram
13197,525,4.62799548,Mamasuka Nori Panggang Rumput Laut Tabur 18gr 4 pcs
13198,57,13.51543116,Mamasuka Rumput Laut Spicy 4.5gr x 2pcs
13205,26,4.36891034,Mamasuka Sushi Nori Reasted Seaweed 20 gram
13207,1,0.5767123508,Mamasuka Tepung Bakwan Krispi Original 80gram 80 gram
13208,25,32.82699638,Mamasuka Tepung Bakwan Krispi Original 225 gram
13214,2,4.782329267,Mamasuka Tepung Bumbu Ala Resto 900 gram
13216,15,18.44736126,Mamasuka Tepung Bumbu Krispi Lada Hitam 170 gram
13218,10,5.790194733,Mamasuka Tepung Pisang Goreng Vanila 210 gram
13219,6,3.485405411,Mamasuka Tepung Roti 1 kg
13220,97,32.50943621,Mamasuka Tepung Roti 500 gr 500 gram
13224,16,20.10793637,Mamasuka Thousand Island 300 gram
13249,38,12.15323924,Manda Keripik Beling Ngangenin 120 gram
13250,66,16.67650854,Manda Keripik Beling Nyebelin 120 gram
13251,32,2.181451466,Manjun Seaweed Corn Oil 3 x 5gr
13255,5,0.50239059,Manjun Seaweed Olive Oil 3 x 5gr
13266,18,23.87003006,Marina Body Lotion Natural Moisturizing 335ml
13278,"1,326",43.3188875,Rose Brand Santan Cair 200 ml
13282,49,9.718392144,Sajiku Tepung Bumbu Serbaguna 80 gram
13302,175,443.9110827,Pantene Shampoo Anti Dandruff 750 ml
13316,155,3.947233187,Refina Garam Meja 250 gram
13317,3,0.2482800791,Pop Mie Snek Kuah Baso Mie Instan Cup 38 gram
13320,25,8.537474941,Aqua Mineral Water 330 ml
13322,20,0.6593047783,AQUA Reflections Sparkling Water Glass Bottle 380 ml
13325,47,82.55314657,Arirang Rice Vermicelli Bulgogi/Mie instan 70gram 70 gram
13326,200,215.0401237,Arirang Rice Vermicelli Curry/Mie instan 73gram 73 gram
13343,129,12.43386232,Asepso Bar Soap Reguler 80 gram
13346,42,29.51842381,Autan Lotion Anti Nyamuk Sakura 50 ml
13355,676,14.76228345,Biskuat Energy Original Reno Biskuit 106 gram
13357,289,5.640361415,Biskuat Energy Cokelat Reno Biskuit 106gram 106 gram
13386,6,9.552585055,Glade Aerosol Lemon/Pewangi Ruangan 225ml 225 ml
13394,40,24.32348854,Glade Aerosol Wild Berries/Pewangi Ruangan 350 ml
13396,3,1.082330536,Glade Bathroom Gel Fresh Air 75gr/Pewangi Ruangan 75gram 75 gram
13397,1,0.1116548495,Glade Bathroom Gel Lavender 75gr/Pewangi Ruangan 75gram 75 gram
13398,20,20.71723868,Glade Bathroom Gel Lemon Zest 75gr/Pewangi Ruangan 75gram 75 gram
13399,9,1.327696073,Glade Bathroom Gel Mountain Pine 75gr/Pewangi Ruangan 75gram 75 gram
13405,8,1.584081319,Glade Hang It Lavender 8gr/Pewangi Ruangan 8gram 8 gram
13406,6,5.432292862,Glade Hang It Wild Berries 8gr/Pewangi Ruangan 8gram 8 gram
13413,9,0.6735859067,Glade Scented Gel Lavender 180gr/Pewangi Ruangan 180 gram
13428,13,23.74128011,Heinz Apple Cider Vinegar 896 ml
13443,29,16.84410549,Heinz Distilled White Vinegar Cuka Putih 437 ml
13446,709,18.79334071,Hello Panda Biskuit Strawberry Biskuit 25 gram
13448,6,72.2032388,Hemaviton Cardio 10pcs 10 pcs
13450,51,5.352047177,HIT Aerosol Pink Blossom Obat Nyamuk 600 ml
