Product ID,Sum of Stock,DOI,Product Name
32112,129,46.24969185,Kopi Arabika Bali Kintamani Astro Goods 200 gram
32113,30,10.5059878,Kopi Arabika Toraja Astro Goods 200 gram
32145,453,33.57886584,NYU Henna Shampoo Hair Colour Natural Black 1 pcs
32146,71,4.024580336,Polytex Kantong Plastik Sampah Large 80cm x 100cm 8 pcs
32147,138,4.308155752,Favour Molang Gentle Touch 2 Ply Tisu Wajah 200 Sheets
32152,18,142.8311274,Favour Prestige Gentle and Soft 3 Ply Tisu Wajah 160 Sheets
32178,50,4.153174,Jardin Minuman Teh Ice Tea Peach 230 ml
32187,122,4.053899765,Polytex Kantong Plastik Sampah Medium 60cm x 80cm 10 pcs
32188,"2,692",154.750604,Paper Bag A Basics Isi 5 pcs 1 Pack
32191,107,6.721330233,NYU Henna Shampoo Hair Colour Natural Brown 1 pcs
32192,70,3.066101536,Polytex Kantong Plastik Sampah Xtra Large 100cm x 120cm 5 pcs
32195,270,15.94727333,Jardin Signature Americano Sweet 230 ml
32196,100,6.115649862,Jardin Signature Royal Hazelnut 230 ml
32204,16,85.03084406,East Java & Co Organic Ground Turmeric 45 gram
32209,4,0.06536708101,Royco Bumbu Kaldu Rasa Sapi 94 gram
32210,18,6.440690781,Bango Kecap Manis Refill 540 gram
32219,45,7.925623626,Pura Seasoning Kaldu Sapi 100 gram
32222,33,3.05314282,Emaku Bubuk Tabur Daun Parsley 15 gram
32223,1,0.1603380884,Emaku Bubuk Tabur Pala 60 gram
32227,38,44.51245671,Muria Makaroni Pedas 70gram 70 gram
32228,74,45.60968784,Muria Kacang Kedelai 60gram 60 gram
32229,20,11.3467628,Muria Marning Pedas 120 gram
32230,3,18.41609113,Muria Telur Ikan 110gram 110 gram
32238,446,151.5412612,Mixmix Eastern Dry Rub 110 gram
32239,141,10.96206137,Bango Kecap Manis Refill 210 gram
32244,96,1.854699261,Nestle Pure Life Air Mineral Dus 600ml 24 Bottles
32252,12,14.61277611,East Java & Co Amed Sea Salt 440 gram
32253,29,27.87340709,Zoda Soda Water 250ml 24 Bottles
32254,100,6.974516391,Ayana Beras Pandan Wangi 5 kg
32261,43,6.731463815,Pocari Sweat Isotonic Water 330ml 24 pcs
32299,53,4.986112115,SoSoft Rose & Waterlily Deterjen Cair 360 ml
32300,43,24.53063449,So Soft Deterjen Cair Sakura Blossom Pouch 360ml 360 ml
32301,40,20.45521212,SoSoft Freesia & Pear Deterjen Cair 360 ml
32302,349,14.11183745,Stella Electric Device Pengharum Ruangan 1 Pack
32303,100,15.7222968,Stella Electric Jasmine Breeze Pengharum Ruangan Refill 25 ml
32304,63,11.36305037,Stella Electric Lavender Bloom Pengharum Ruangan Refill 25 ml
32307,14,13.35727402,Fitkom Gummy Strawberry Funtasy 5 Sachets
32333,11,65.24641899,Arizona Drinks Mucho Mango 652 ml
32346,5,2.896268311,Yeo'S Chrysanthemum Tea 250ml 24 pcs
32347,1,4.927511353,Yeo'S Chrysanthemum Tea 300ml 24 pcs
32348,5,9.208367686,Yeo'S Winter Melon Tea 300ml 24 pcs
32352,33,19.06867351,Ito En Oi Ocha Green Tea 500ml 24 Bottles
32353,34,21.10637003,Ito En Unsweetened Jasmine Green Tea 500ml 24 Bottles
32356,197,8.169439965,Mr. Crispy Sambal Bawang 120 gram
32357,74,6.572433615,Mr. Crispy Sambel Terasi 120 gram
32358,72,5.172881702,Mr. Crispy Sambal Cakalang 120 gram
32359,486,25.55261876,Mr. Crispy Sambal Pete 120 gram
32360,231,8.542400928,Mr. Crispy Sambal Cumi Asin 120 gram
32371,184,7.673168254,Frisian Flag Bendera Kental Manis 6pcs x 38gr
32372,82,19.72714374,Frisian Flag Bendera Cokelat Kental Manis 6pcs x 38gr
32385,50,54.6818198,Enervon Gold Vitamin C Dan B Complex Suplement Produktivitas 50 Kapsul
32395,47,82.25061214,Interlac Probiotik Strawberry Tablet Kunyah Suplemen Strip 1 Strips
32396,41,10.63721342,Montiss Tissue Softpack 185sheets 185sheets 185 Sheets
32397,36,179.1631705,Sasa Bumbu Kaldu Sapi Penyedap 1 kg
32398,40,8.187991873,Sasa MSG Penyedap 500 gram
32414,40,4.582144749,Mr. Crispy Kremes Ayam Ori  150 gram
32419,19,16.7417623,Caffino Oat Cappuccino Kopi Kemasan 200 ml
32420,17,23.97778008,Caffino Milky Espresso Kopi Kemasan 200 ml
32427,72,37.0548009,Tropicana Slim Topping Kental Manis Sugar Free 150 ml
32441,10,0,Best Wok Mie Goreng Xtra Hot Xtra Spicy Mie Instan 75 gram
32442,3,0.09019603159,Best Wok Mie Goreng Korean Spicy Cheese Mie Instan 73 gram
32443,4,0,#N/A
32471,18,83.37828804,Loxus Hard Surface Pembersih Nat Lantai Granit Keramik 500 ml
32475,42,140.2720151,Miss Daisy French Perfume Peony & Amber Shampoo 500 ml
32478,4,40.33320725,Acne Patch By Mathis Women Hydrocolloid Pimple Patch - Sakura 12pcs 1pack 1 Pack
32483,29,165.1802581,SHRD Protein Cream Hair Vitamin & Heat Protection Perawatan Rambut 50 ml
32497,25,6.193054589,Oreo Chocolate Biscuits 36 gram
32502,73,2.9771772,Pediasure Go UHT Vanilla 110 ml
32503,98,4.850969381,Pediasure Go UHT Chocolate 110ml 110 ml
32504,6,5.915600822,Yummy Bites Meal Step 1 Sweet Pumpkin Pear 145 gram
32505,57,68.79660762,Yummy Bites Meal Step 1 Sweet Potato & Rice 145 gram
32506,87,93.22372999,Yummy Bites Meal Step 1 Sweet Pumpkin & Cheese 145 gram
32507,10,8.082032109,Yummy Bites Meal Step 2 Chicken Broth & Rice 145 gram
32508,10,1.888510121,Yummy Bites Meal Step 2 Potato Risotto With Cheese 145 gram
32509,1,0.7535449243,Yummy Bites Meal Step 2 Chicken Carrot & Oyster Mushroom 145 gram
32510,38,25.68207112,Yummy Bites Meal Step 3 Tuna & Mix Vegetable 145 gram
32511,73,37.49893533,Yummy Bites Meal Step 3 Salmon & Mix Vegetables 145 gram
32512,13,7.771129806,Yummy Bites Meal Step 3 Beef Carrot & Potato 145 gram
32518,6,3.878438868,Cj Hetbahn Cooked Black Rice - Nasi Hitam Instan Korea 210 gram
32519,40,21.79950338,Cj Hetbahn Nasi Putih Instan Korea Bundle 3pack x 210gr
32524,114,94.02163937,Grouu Date Paste MPASI Makanan Bayi Anak 250 gram
32528,16,27.39911232,Dogtat Cream Chocotat Hazelnut 55 gram
32529,50,46.35357216,Dogtat Cream Chocotat Strawberry Cream 55 gram
32530,28,50.60001291,Dogtat Cream Chocotat Peanut Butter 55 gram
32531,11,96.58745942,Dogtat Cream Chocotat Pistachio 55 gram
32543,19,705.6102254,Natur-E Ceraglow Skin Barrier Calming Moisture Gel 30 ml
32544,1,31.43749397,Natur-E Ceraglow Skin Barrier Calming Serum 20 ml
32547,38,51.18583876,Joshu Akagi Somen 270 gram
32548,40,548.3021977,Joshu Akagi Kishimen 270 gram
32552,380,11.34645539,MaLing Luncheon Meat 170 gram
32556,49,2.582948858,Norigo Nori Tabur Original 60 gram
32557,8,5.637447514,Shinsunmi Gochugaru Korean Hot Chilli Powder 450 gram
32558,110,7.410292893,Green Valley Macaroni & Cheese 4 Cheese Quattro Formaggi 200 gram
32559,48,0,Bellamy's Organic Susu Formula Step 1 0-6 Bulan 900 gram
32563,3,2.852151033,Caffino Kopi Latte Premium Bold 3 In 1 10 Sachets
32564,43,15.05557289,Moell Body Wash 185 gram
32565,11,3.640400263,Moell Shampo Bayi 185 gram
32576,14,0.82015035,Koepoe Parsley 19 gram
32577,22,29.58372441,Koepoe Kencur Bubuk 23 gram
32578,33,39.75219802,Koepoe Bumbu Ngohiang 23 gram
32579,43,78.28828445,Koepoe Sendawa 74gram 74 gram
32580,26,29.66247796,Koepoe Lengkuas Bubuk 22 gram
32581,3,0.5149314278,Koepoe Lada Putih Bubuk 38 gram
32583,49,41.22380574,Koepoe Koepoe Perisa Alami Bawang Putih Bubuk 130 gram
32584,19,31.62499924,Koepoe Basil 13 gram
32587,31,35.65114966,Koepoe Soda Kue 1 kg
32588,4,3.93488385,Koepoe Cream of Tartar Krim Bubuk Pelapis Kue 43 gram
32591,3,3.244998107,ABC Sambal Extra Pedas Pouch 75 gram
32592,61,26.92906328,Del Monte Ketchup Saus Tomat Pouch 500 gram
32596,"1,732",6.818088198,Cleo Air Murni Galon 12800 ml
32597,269,6.346256443,Cleo Air Murni Multipack 1500ml 6 Bottles
32601,43,6.053330067,Monde Butter Cookies Biskuit  90 gram
32602,72,15.47982851,ABC Sambal Extra Pedas Pouch  380 gram
32605,9,167.0999039,Herbamojo Small Pack 30 Kapsul
32609,6,12.06252509,Renovit Gold Multivitamin 30 Kapsul
32645,159,95.14531054,Buku Tulis Sekolah A Basics 5 pcs
32646,197,136.023965,Buku Tulis Campus A Basics 5 pcs
32647,308,95.72907448,Buku Gambar A Basics 1 pcs
32677,27,39.35590382,Bundaberg Minuman Soda Burgundee Creaming 375 ml
32678,52,4.616805912,Bundaberg Minuman Soda Ginger Beer (Non Alcohol) 375 ml
32679,2,3.031159571,Bundaberg Minuman Soda Guava 375ml 375 ml
32680,19,12.03716781,Bundaberg Minuman Soda Passion Fruit 375 ml
32681,7,5.443546644,Bundaberg Minuman Soda Sarsaparilla 375 ml
32684,23,4.069352178,Homesoy No Sugar Added Soya Milk 250ml 250 ml
32691,51,17.47937368,Madam Pum Suki Sauce 320 ml
32692,20,45.76746643,Fever Tree Tonic Water - Indian 200 ml
32711,38,1.129168358,Sakao Nori Sushi Spesial Sushi Roasted Rumput Laut 10 Sheets
32714,4,33.11018977,Lee Kum Kee Pure Sesame Oil 1750 ml
32715,24,2.359680018,Kikkoman Yakiniku Sauce Halal Botol 300 gram
32716,10,13.48421893,Kikkoman Katsu Sauce Halal Botol 300 gram
32717,23,36.7953011,Munik Bumbu Gado - Gado 200 gram
32718,72,9.67182901,Munik Bumbu Munik Pecel 200 gram
32719,7,10.11871772,Munik Bumbu Empal 110 gram
32728,6,0,#N/A
32731,24,151.4832596,Mr. P Chili Roasted Cashew Nuts - Kacang Panggang Mete Rasa Balado 80gram 80 gram
32732,63,60.8754853,Javara Pemuteran Sea Salt Garam Laut Murni 300 gram
32733,64,42.61513143,Wong Coco Mangga Puding Banded 3pcs x 120gr
32734,22,16.5970499,Wong Coco Leci Cubes Nata De Coco 1 kg
32735,59,12.35175913,Wong Coco Lemon Cubes Lidah Buaya 280 gram
32736,13,17.97660728,Wong Coco Mini Jelly 15pcs x 14gr
32738,177,17.39148347,Bango Kecap Manis Rendah Gula 520 ml
32743,670,7.826505944,Maizenaku Corn Starch/ Tepung Maizena 150 gram
32744,51,13.7812726,PSM Gula Premium 1 kg
32745,225,59.54948216,GMP Gula Pasir Premium 1 kg
32746,98,6.830196506,Lady Speed Stick Deodorant Wild Freesia 45 gram
32747,6,0.8202585314,Lady Speed Stick Deodorant Powder Fresh 39 gram
32749,8,2.778779693,Mitu Wetties Wipes Tisu Basah 10sheets 10 Sheets
32757,19,139.7806334,J & W Celebration Sparkling White Grape Juice 750 ml
32758,1,4.029920574,J & W Pink Cocktail Sparkling Grape & Raspberry Drinks 750 ml
32760,19,11.0975077,Namaste Sunday Morning Pancake Waffle Mix Original 220 gram
32763,11,38.09802924,Namaste Vegan Dark Choco Brownie Crisps 90 gram
32764,2,8.926971346,Namaste Seeckers Seed Cracker Sweety 70 gram
32765,5,5.786670473,Namaste Kaasstengels Classic Cheese Gluten Free Cookies 100 gram
32768,34,78.41581327,Bali Forages Beef Chips Original 35 gram
32769,3,3.956407889,Bali Forages Beef Jerky Classic Pepper 50gram 50 gram
32770,11,70.82839397,Bali Forages Beef Chips Classic Pepper 35 gram
32771,31,34.66683353,Bali Forages Beef Jerky Original 35 gram
32772,61,54.95672132,Bali Forages Chicken Chips Original 35 gram
32773,48,82.2527141,Bali Forages Beef Jerky Chili 35gram 35 gram
32775,37,58.90346453,Heinz Distilled White Vinegar Heinz Cuka Putih 946 ml
32776,44,29.0849613,Lea Perrins Worchester Sauce Kecap Inggris 284 ml
32777,16,15.66349488,Mr. Brown Kopi Kemasan Caramel Macchiato Coffee 330 ml
32778,35,20.83954582,Mr. Brown Kopi Kemasan Black Coffee 240 ml
32779,50,43.9633675,Mr. Brown Blue Mountain Blend Coffee 240 ml
32794,23,61.79722115,Gatsby Eau De Blue Eau De Parfum Earth Code 100 ml
32795,28,618.3512846,Gatsby Eau De Blue Eau De Parfum Air Code 100 ml
32796,10,75.46958322,Gatsby Eau De Blue Eau De Parfum Skyline Code 100ml 100 ml
32797,10,35.50630088,Gatsby Eau De Blue Deodorant Roll On Earth Code
32799,2,14.16537981,Gatsby White Up Eau De Toilette Blanc Wood 50 ml
32801,12,82.47954033,Gatsby White Up Eau De Toilette The Minimalist 50 ml
32803,4,11.39121484,Pucelle Eau De Luxe Body Spray Lucent 150ml 150 ml
32805,30,112.147794,Pucelle Audacity Eau De Parfum Valorous 50ml 50 ml
32812,12,0,Only Organic Vegetable Macaroni Cheese Kindy 1-5 Years Makanan Bayi 220 gram
32813,1,0,Only Organic Vegetable Chicken Risotto Kindy 1-5 years Bubur Bayi 220 gram
32815,197,24.96729653,X2 Contacts Obat Tetes Mata 15 ml
32821,91,33.96949545,Cap Panda Bird Nest 310 ml
32823,241,2.508066183,Sari Choco Spread Selai Cokelat 150gram 150gram 150 gram
32834,241,7.051250879,Colgate Optic White Purple Toothpaste 100 gram
32835,25,4.846131048,Grace and Glow Brightening Solution Body Wash 400 ml
32836,46,8.724277088,Grace And Glow English Pear And Freesia Acne Solution Body Wash 400 ml
32837,12,14.18780887,Grace and Glow Silky & Protect Care Hair Mist 100 ml
32838,7,6.797072075,Grace and Glow Bright & Smooth Deodorant Serum  50 ml
32839,21,7.537240371,Grace and Glow Rouge 540 Glow & Firm Scrub Solution Body Wash 400 ml
32841,31,5.813483654,Blood Corn Pads 25 cm 1 Pack
32842,52,5.94932547,Blood Corn Ultrathin 29cm Heavy Pembalut Wanita 12 pcs
32843,49,6.478408931,Blood Corn Ultrathin 33cm Extra Heavy Pembalut Wanita 10 pcs
32844,14,5.665587016,Blood Corn Panty Pads Size M/L (92-120cm) - 4 pcs 1 Pack
32860,10,10.68959836,Good Day Groovy Cookies Coffee/Kopi 250 ml
32881,38,76.11273459,Binggrae Acafela Americano 240 ml
32885,40,12.76544085,Dr. Pepper Soft Drink 355 ml
32886,4,0.77207755,Milo Nutriactiv Choco Cereal Multigrain 180ml 180 ml
32891,80,6.212360135,Heinz Chicken Broth 250 ml
32893,6,3.17739436,Tong Garden Salted Macadamias 35 gram
32895,12,14.0379585,Tong Garden Honey Macadamias 35 gram
32904,21,0.4518121167,Gehel Mie Lidi Pedas 200gram 200 gram
32906,10,10.21721922,Bear Brand Nestle Susu Steril 30pcs x 189ml 1 Carton
32907,1,2.880917079,King'S Fisher Tuna Chunk In Oil 1800 gram
32909,21,8.819569762,Vinisi Chunk Light Tuna/ Daging Tuna Kaleng 160 gram
32913,47,28.05453613,Makarizo Hair Energy Scentsations Hair Fragrance Cherry Blossom  100 ml
32914,220,14.75291777,Makarizo Hair Energy Vitaglitz Hair Serum Royal Jelly 1ml x 6pcs 1 Pack
32915,125,10.1837337,Makarizo Hair Energy Vitaglitz Hair Serum Aloe Melon 1ml x 6pcs 1 Pack
32920,3,10.27055466,Morin Mini Portion Blueberry Jam 14gr 48 pcs
32921,1,2.416905846,Morin Mini Portion Strawberry Jam 14gr 48 pcs
32922,5,7.387200237,Yummy Bites Beberoll Baby Snack Orange 40 gram
32925,11,0.6902918458,Beorganik Peanut Butter Original Crunchy 280 gram
32926,14,32.02878475,Beorganik Strawberry Jam 280 gram
32941,282,11.18314243,Mujigae by Wonhae Fried Rose Ramyun 120gram 120 gram
32942,152,9.450267893,Mujigae by Wonhae Spicy Rapokki 260 gram
32943,38,28.08647679,Omo! Krispy - O Snack Bayi Blueberry 15 gram
32944,16,30.57617638,Omo! Krispy - O Snack Bayi Ayam Jagung 15 gram
32945,27,15.23614278,Omo! Krispy - O Snack Bayi Straw Apple 15 gram
32949,31,5.187170293,Balans Recharge Honey Lemon Fiber & Probiotics Drink 210 gram
32950,5,0,Balans Active Powder Mixed Berries Fiber & Probiotics Drink 210 gram
32951,6,6.641333539,Namaste Cheese Sourdough Cracker 150 gram
32990,45,11.25151668,Rinso Anti Noda Perfume Essence Deterjen Bubuk 380 gram
32991,38,3.437594917,Paseo Wipes Anti Bacterial/Wet Tisue 50sheets 50 Sheets
32993,268,0.7168442587,Sun Kara Santan Kelapa 65 ml
32998,12,0.30842718,Paratusin Obat Flu Dan Batuk 10 Tablet
33011,5,16.0876628,Caviplex Multivitamin & Mineral 100 Kapsul
33026,8,104.7614064,Comvita Manuka Honey Umf 10+ Madu Murni Alami Asli New Zealand 500 gram
33031,6,0.460417125,Longkou Sohun Vermicelli 500 gram
33032,324,7.139427161,Lungkou Vermicelli Sohun 50 gram
33039,18,18.44619586,Mamata Mushroom/ Jamur Kancing Dalam Kaleng 198 gram
33040,30,23.20478526,Namaste Original Sourdough Cracker 150 gram
33042,6,32.01101744,Namaste Choco Bagelen Sourdough 240 gram
33043,20,16.99241487,Namaste Italian Herbs Sourdough Cracker 150 gram
33045,9,27.01656899,Namaste Mixy Choco Instant Oat 70 gram
33046,12,12.88311763,Country Kitchen Original Syrup 710 ml
33047,2,1.117803351,Maple Joe Absolutely Pure Maple Syrup 450 gram
33052,12,1.081173102,Vina Pho Rice Noodle Vietnam 400 gram
33053,27,13.06142556,Promina Bubur Bayi 6+ Tim Sapi Wortel Box 120 gram
33054,86,39.91686709,Promina Bubur Tim Salmon Norwegia Box 100 gram
33056,5,0.438598828,Kokoku Basmati Premium Gold Rice 1 kg
33062,18,56.07927367,Karihome Goat Milk Formula 6-12 Month Step 2 400 gram
33064,14,10.65254538,Ottogi Yeul Ramen 120gram 120 gram
33070,6,5.378017553,Mr Ishii Tsubu Beras Shirataki Basah Diet Keto 200gram 200 gram
33078,231,5.484905485,Esse Change Double Mangoburst & Applecrush Capsule Rokok 20 Stick
33080,183,94.42439977,Newlab Brightlogy Glutacoll-5500 Suplemen Box 7 Sachets
33081,257,182.6560524,Newlab Fitlogy Fiber 30B-Probio  7 Sachets
33082,204,55.4835525,Newlab Fitology Tea Drink Slimming & Detox Tea Suplemen Box 14 Sachets
33083,221,8.510494232,Kobe Bumbu Nasi Bebek 20gr 3 pcs
33084,279,11.50889183,Kobe Bumbu Rendang 20gr 3 pcs
33085,74,33.40254876,Natur-E Advanced Vitamin E Dan Astaxanthin 32 Kapsul
33087,41,23.32800843,Natur-E Skin Start Nat Vitamin E 100 IU 32 Kapsul
33093,34,4.529362649,Kikkoman Oyster Sauce Halal Botol 300gram 300 gram
33094,8,36.43421516,Kikkoman Sweet Sauce Khas Jawa Halal Botol 300gram 300 gram
33095,7,55.25745031,Boost Optimum Susu Bubuk Kaleng 800 gram
33167,1,0.692372381,Alang Sari Cool 300 ml
33170,149,282.4496509,Morinaga Chil Kid P-HP 1-3 Tahun Susu Formula 800 gram
33177,65,0,#N/A
33185,910,0,Dunhill Fine Cut International Menthol Rokok 20 Stick
33186,13,0,#N/A
33187,49,0,#N/A
33188,4,0,#N/A
33189,45,18.3342491,Favour Prestige Gentle and Soft Travel Pack 3 Ply 50 Sheets
33192,32,189.093437,Mustela Bebe Gentle Cleansing Gel 500 ml
33200,205,6.814587351,Cussons Baby Cotton Buds 1 Pack
33207,10,1610.708039,Nutrimax Dha Plus Vitamin 30 Tablet
33208,36,10.62850426,Snap Clean Siklus Handsoap Strawberry Jerigen 4liter 4 Liter
33209,9,2.695259657,Snap Clean Siklus Karbol Sereh Jerigen 4liter 4 Liter
33210,27,18.50789181,Snap Clean Siklus Floor Cleaner Apel Jerigen 4liter 4 Liter
33211,180,62.06238619,Snap Clean Siklus Sabun Cuci Piring Jerigen 4 Liter
33212,53,16.07863971,Snap Clean Siklus Deterjen Cair Jerigen 4 Liter
33213,13,20.19712988,Snap Clean Siklus Pelembut Pakaian 4 Liter
33214,35,102.1429863,Snap Clean Siklus Glass Cleaner Jerigen 4liter 4 Liter
33215,55,399.7332715,Snap Clean Siklus Bowl Getter Jerigen 4 Liter
33230,120,7.609104187,Sajo Gochujang Sambal Pasta Korea Hot Pepper Paste 500 gram
33232,8,1.601515884,Wan Ja Shan Sukiyaki Sauce/ Saus Hot Pot Sukiyaki 450 ml
33235,32,37.38130037,Yamasa Sashimi Soy Sauce 200ml 200 ml
33236,44,30.61891379,Bragg Organic Apple Cider Vinegar 946 ml
33243,449,4.467156969,Wonhae Banana Milk Bites 60 gram
33245,477,22.44867606,Wonhae Nori Crispy Seaweed Snack 20 gram
33247,183,5.15897244,Mujigae by Wonhae Gummy Choco Ball Truffle Mixed Fruit 35 gram
33256,8,18.1200486,Acnes Sealing Gel 18 gram
33257,32,62.56611116,Acnes Spot Care 12gram 12 gram
33259,250,245.7781495,Harlette Oat Probiotic Lightweight Sunscreen Spf 50 Pa++++ 40 gr
33260,169,1106.867602,Harlette Oatmilk Sleeping Mask 30 gram
33271,721,0,#N/A
33273,"4,950",0,#N/A
33275,30,17.78849488,Yamasa Teriyaki Sauce Marinade & BBQ 300 ml
33278,2,4.248706453,Granova Honey Almond 270 gram
33288,54,21.21173447,Ladang Lima Pancake Mix 220 gram
33302,45,11.14477387,Arm & Hammer Pure Baking Soda 226 gram
33303,160,8.789691426,Bamboe Bumbu Tongseng 80 gram
33304,85,2.852235289,Dixi Cuka Masak 100 ml
33312,7,0,#N/A
33313,474,0,#N/A
33320,1,2.762621006,"Hundred Seeds Granobar Dates, Almond & Chia Seeds"
33321,7,23.52369431,"Hundred Seeds Granobar Chocolates, Almonds & Cashews 5pcs"
33326,25,21.69010069,Hup Seng Sugar Crackers 428 gram
33336,"3,162",204.5968166,Sabut Spons Stainless A Basics 1 pcs
33338,1,0,#N/A
33350,"2,055",663.8534256,Beras Porang Pouch Astro Goods 500 gram
33357,13,1.546336877,See-U Classic Facial Tissue Classic 250 Sheets
33368,55,12.19189691,Gehel Basreng Pedas Biasa 200 gram
33371,18,18.13117332,Silex Obat Batuk Sirup 100 ml
33372,19,6.185089889,Sterimar Baby Nasal Spray 50 ml
33375,11,169.0248728,Viostin Suplemen Kesehatan Tulang dan Sendi 30 Kapsul
33383,32,125.1378805,Fu Chi Chilli Bean Sauce 200 gram
33384,19,53.52248631,Alang Sari Plus Jeruk Nipis
33385,2,7.868067853,Alang Sari Plus Sirsak 6sheets 6sheets 6 Sheets
33386,65,31.47541419,Hoppi Baby Wet Wipes
33389,110,52.99975513,Tessa Nature Facial Tissue 3ply 60sheets 60sheets 60 Sheets
33390,77,9.323705368,Tessa Nature Tisu Toilet 220 Sheets
33391,81,3.045367601,Tessa Facial Tissue 2ply 250 Sheets
33392,14,6.745423378,Tessa Tisu Toilet 3ply 12roll x 300sheets
33393,80,43.39357389,Tessa Travel Sweets 3 Ply Tisu Wajah 50 Sheets
33394,119,13.33368902,Hotto Purto Multigrain Purple Potato Suplemen Sachet 16 Sachets
33395,7,181.777868,Prima Home Dishwashing Regular 800ml 800 ml
33396,18,64.5943672,Prima Home Hand Soap Musky Mist 800ml 800 ml
33397,5,36.26020468,Prima Home Floor Cleaner Lavender 800 ml
33398,35,129.683471,Prima Home Carbol Lemon Grass 800 ml
33399,19,514.6511626,Prima Home Window & Glass Cleaner 500 ml
33411,24,114.4416542,Flimburn 1 Botol 60 Kapsul
33422,22,20.83065694,Cap Burung Kakak Tua Obat Sakit Gigi 2ml 2 ml
33426,17,869.5076601,Namaste Organic Jumbo Sweety Seeckers Seed Crackers 170 gram
33427,11,269.8647084,Namaste Organic Jumbo Salty Seeckers Seed Crackers 170 gram
33429,49,8.992370455,Bungasari Hana Emas Tepung Terigu Premium Cake Dan Cookies 1 kg
33430,2,0.6480706609,Falcon Tepung Terigu 1 kg
33431,59,35.66781951,Bungasari Kabuki Gold Tepung Terigu Super Premium Khusus Roti 1 kg
33432,18,51.33357688,Bungasari Niji Tepung Terigu Cake dan Biskuit 1 kg
33433,35,36.79487758,Sriboga Hime Tepung Terigu Roti Tawar dan Manis 1 kg
33434,57,38.6204384,"Sriboga Hime Tepung Terigu Double Zero Roti, Pastry, Pizza 1 kg"
33435,59,127.9296977,Ibis Pelembut Roti 20gr 4 Sachets
33436,15,60.90041335,Mauripan Ragi Kering Instant 500gram 500 gram
33438,28,2.438791896,Hercules Baking Powder 110 gram
33440,90,243.9015093,Elmer Dip Glaze Saus Manis Berbagai Rasa Strawberry 200 gram
33442,94,16.16537774,Elmer Dip Glaze Saus Manis Berbagai Rasa Green Tea 200 gram
33443,2,4.320746432,Elmer Dip Glaze Saus Manis Berbagai Rasa Tiramisu 200 gram
33444,60,94.52624643,Elmer Dip Glaze Saus Manis Berbagai Rasa Dark Chocolate 200 gram
33446,4,22.77565663,Hollman Buttercream Vanilla 1 kg
33451,16,38.20822931,Namaste Organic Alchemy 330 ml
33456,74,2.614579308,Java Super Food Minyak Wijen 135 ml
33469,34,28.03520534,Jesscool Penyegar Panas Dalam 6tablet 6 Tablet
33472,12,30.20035275,Earth Love Life Bulgarian Rose & East Nusa Vanilla Body Lotion Serum 250 ml
33483,41,4.067747114,Uma Organic Cotton Cover Pads Ultra Slim Overnight 35cm Pembalut Wanita 8 pcs
33497,44,1.694264868,Cuka Dixi Cuka Masak 650ml 650 ml
33498,114,20.20520229,L-Men Protein Bar Chocolate 22 gram
33501,60,65.39545189,Namaste Organic I Heart Monday Double Choco Oatmeal 45 gram
33524,324,5.259120778,Ultra Milk Strawberry Susu UHT 750 ml
33526,993,63.84863187,Ultra Milk Mocca Susu UHT 750 ml
33538,1,3.104712024,The Originote Cica-B5 Soothing Moisturizer 50 ml
33539,19,8.534532268,The Originote Mugwort B3 Clay Stick Face Mask 30 gram
33542,13,220.7411845,Hoppi Airdream Diapers NB66 Tape 1 Pack
33543,10,15.54412099,Hoppi Airdream Diapers S56 Tape 1 Pack
33544,2,14.0925758,Hoppi Airdream Diapers M48 Tape 1 Pack
33546,8,160.4545334,Hoppi Airdream M44 Diapers Pants 1 Pack
33548,17,567.5269202,Hoppi Airdream XL32 Diapers Pants 1 Pack
33555,1,7.561759605,Crown Haitai Saltine Crackers 56 gram
33558,9,12.79927021,Oreo Cookie Crumb 1 kg
33590,58,3.128121396,Palm Sugar Pido Gula Palem Gula Aren 250gram 250 gram
33636,35,5.802842929,Nang Fah Brand Sriracha Hot Chili Sauce 200 ml
33640,76,70.42754574,Saf Instant Ragi Kering 11gr 5 Sachets
33646,24,12.30648293,Bayclin Bleach Regular 4 Liter
33647,6,23.10904608,Kiwi Polish Semir Sepatu Brown 45 ml
33649,39,14.07478407,Baygon Aerosol Flower Garden 400 ml
33650,25,30.63014846,Baygon Aerosol Silky Lavender 400 ml
33654,72,2.999346003,Prendjak Teh Celup 25 pcs
33656,"1,097",4.182863827,Ritz Keju Biskuit Sandwich 91 gram
33657,211,10.16631667,HIT Aerosol Lily Blossom 750ml/Obat Nyamuk/Pembasmi Serangga 750 ml
33658,393,59.40383018,HIT Aerosol Orange Obat Nyamuk/Pembasmi Serangga 750 ml
33659,94,40.63852604,Balans Lite Powder Drink Tropical Fruit Flavored Tube 210 gram
33667,128,85.6591352,Nang Fah Brand Sriracha Hot Chili Sauce 450 ml
33685,60,1.162426308,Delfi Orion K Rice Seaweed 6 packs 47 gram
33686,114,3.767284943,Delfi Orion K Rice Sweet 6 packs 64 gram
33689,619,0,#N/A
33723,3,0,#N/A
33736,869,116.7339176,Celana Dalam Disposable Wanita Size L A Basics 6 pcs
33737,383,145.7168301,Celana Dalam Disposable Pria Size L A Basics 6 pcs
33738,584,0,Celana Dalam Disposable Wanita Size XL A Basics 6 pcs
33739,228,82.32218662,Celana Dalam Disposable Pria Size XL A Basics 6 pcs
33741,4,0.7569915691,Confidence Popok Celana Dewasa Extra Serap L8 1 Pack
33742,30,12.307578,Confidence Popok Dewasa Perekat Classic Night L 7s 1 Pack
33743,542,34.85272501,Betadine Solution Obat Luka Antiseptik 5 ml
33744,62,6.322029137,Betadine Solution Obat Luka Antiseptik 15 ml
33747,39,1.855104439,Nin Jiom Pei Pa Koa Obat Batuk Cap Ibu dan Anak 75 ml
33756,26,2.424610304,Biore Make Up Remover Micellar Water Soften Up 90 ml
33757,75,86.83980115,For Skin's Sake Ultra Thin Toning Pads - Kapas Toner Tipis 240 pcs
33758,370,31.77541864,For Skin's Sake Kapas Premium Round Cotton Pads - 80pcs
33760,948,63.36971378,Tusuk Gigi A Basics 200 Stick
33766,1,26.89501517,Skintific Alaska Volcano Clay Deep Pores Cleansing Clay Mask 55 gram
33767,15,1.487698273,Hoppi Baby Wet Wipes Soft & Thick 8 Packs 7 Sheets
33773,"1,965",4.802755017,Sumo Merah Fortifikasi Khusus Beras Premium 5 kg
33774,673,9.523373418,Sumo Merah Fortifikasi Khusus Beras Premium 10 kg
33786,22,92.90753218,Melts Chocolate Hazelnut Spread 200 gram
33790,22,36.65282935,True To Skin Niacinamide TXA Brightening Serum 20 ml
33791,20,64.99793227,True To Skin Mugwort Cica Soothing & Hydrating Toner Essence 100 ml
33792,81,68.07426397,True To Skin 2 Layer Effortless Cleansing Balm 50 gram
33794,35,7.276972383,Labore Biome Repair Barrier Revive Cream Pelembab Wajah 10 ml
33803,87,1624.568233,True to Skin Bakuchiol Skin Smoothing & Anti-aging Serum 20 gram
33804,48,203.113244,True to Skin Multi Hyaluronic Hydrating & Skin Barrier Serum 20 gram
