Product ID,Sum of Stock,DOI,Product Name
25105,44,4.911527381,Porstex Pembersih Porselen & Keramik Toilet Blue Botol Pembersih Lantai 2 Liter
25107,50,7.997623075,Daia Hijab Clean & Fresh Deterjen Bubuk Bag 1500 gram
25109,50,0,WIngs Biru Sabun Krim 414 gram
25110,9,1.17625189,SoKlin Lantai Fine Fragrance Pembersih Lantai 780 ml
25112,1,0.02382878841,Cling Pembersih Kaca Ocean Fresh 400 ml
25113,138,71.46784125,Cling Pembersih Kaca Ocean Fresh Pembersih Lantai 440ml 440ml 440 ml
25114,76,4.618638582,Ekonomi Siwak & Jeruk Nipis Sabun Krim 380 gram
25115,136,35.51581286,Fresly Pengharum Ruangan Summer Orange/Pewangi Ruangan 400 ml
25116,2,0.1809179942,Fresly Aerosol Aromatic Lavender Pengharum Ruangan 400 ml
25118,6,0.5203914961,SoKlin Pewangi Active Sport Pelicin Pelembut Pakaian 800 ml
25121,37,12.7820397,Rinso Molto Rose Fresh Deterjen Bubuk 380gram 380 gram
25126,29,11.30846114,Superpell Pembersih Lantai Fresh Apple 280ml 280ml 280 ml
25127,51,17.49137072,Superpell Pembersih Lantai Lemon Ginger Pembersih Lantai 280ml 280 ml
25128,60,24.37793764,Wipol Domestos 5 in 1 Classic Pine Action Karbol Wangi Pembersih Lantai Refill 200ml 200ml 200 ml
25129,66,22.08670436,Wipol Domestos 5 in 1 Karbol Lemon Refill Plastik/Pembersih Lantai 200 ml
25130,72,8.502936079,Rinso Molto Anti Noda Perfume Essence Deterjen Cair 510 ml
25132,15,7.227239335,Tessa Nature Kitchen Towel Plastik 1 Roll=100 Sheet 2 Ply/Tisu Dapur
25133,4,3.950575127,Mama Lemon Jeruk Nipis Sabun Cuci Piring Botol 1 Liter
25134,68,3.805900045,Nice Toilet Core Non Emboss 238 Sheets/Tisu Kamar Mandi 6 Rolls
25136,"1,329",95.39628999,Tulip Tisu Wajah 1000 gram
25141,"1,024",195.8080151,Oat Crunch Banana Choco Chips Astro Goods 50 gram
25142,365,12.88491237,Japota Sapi Panggang Keripik Kentang 68 gram
25144,114,5.719926099,Soyjoy Tropical Cranberries Healthy Snack Bar 30 gram
25151,433,8.09044074,Rose Brand Tepung Maizena 250 gram
25221,497,44.15123062,Rinso Kapsul 3 in 1 Lavender Fresh Deterjen Bubuk 16 Kapsul 168 gram
25222,2,0.2143541742,Francis Organic Classic Pancake Mix Chocolate 200 gram
25223,74,1.966605231,Francis Organic Classic Pancake Mix Original 200 gram
25225,13,0,#N/A
25273,230,23.10216864,Francis Organic Honey Coated Sunflower Seeds 100 gram
25274,55,12.07283716,Francis Organic Nutties Original Mix 200 gram
25275,182,7.729718472,Francis Organic Pistachio Asin 31 gram
25276,70,3.010962488,Francis Organic Roasted Cashew 31 gram
25286,6,0,#N/A
25299,"8,200",0,#N/A
25307,677,9.98888723,Chitato Lite Aburi Seaweed 65 gram
25323,790,10.2540518,Sunmi Beras Putih Premium 5 kg
25325,510,3.967359199,Ayana Gold Beras Premium 5 kg
25327,26,8.315009676,My Taste Saus Barbeque Pedas level 3 500 gram
25329,19,4.191591249,My Taste Saus Lada Hitam 500 gram
25358,47,7.993887693,Kodomo Baby Wash Strawberry Kebersihan Bayi 250 ml
25359,18,6.553097078,Kodomo Body Wash Cherry Kebersihan Bayi 200 ml
25360,42,12.04815493,Kodomo Body Wash Blueberry Kebersihan Bayi 200 ml
25361,21,5.886336376,Kodomo Shampoo Cherry Kebersihan Bayi 200 ml
25362,6,2.781597023,Kodomo Top To Toe Aloe Vera 200 ml
25364,20,18.11912218,Banana Boat Ultra Protect Sunscreen Lotion Spf 50++++ 90 ml
25365,11,10.0458024,Banana Boat Simply Protect Aqua SPF 50+ PA++++ 50 ml
25366,2,1.765863695,Banana Boat Ultra Protect Sunscreen Lotion SPF 50 Can 170 ml
25367,8,7.269841783,Banana Boat Sport Colzone Sunscreen SPF 50 Clean Ultramis Spray 170 gram
25368,11,30.25303909,Bebelac 3 (1-3 Thn) Madu Growing Up Bebenutri 1000gr/Susu Formula 1000 gram
25371,9,24.08039415,Head & Shoulders Shampoo Cool Menthol 160 ml
25373,23,15.52286929,Lifebuoy Strong & Shiny Shampoo Pump 680 ml
25374,70,44.73443491,Lifebuoy Anti Dandruff Shampoo Refill 900 ml
25375,29,27.25817926,Dove Serum Shampoo Anti Ketombe Pump 680 ml
25378,314,0,Pepsodent Brilian Soft Sikat Gigi 1 Pack
25381,49,5.822348905,Lifebuoy Total Protect Body Wash 100 ml
25382,57,7.721627332,Lifebuoy Mild Care Body Wash 100 ml
25383,1,27.08690329,Olay Total Effects 7in1 Anti Ageing Day Cream SPF 15 Normal 50 gram
25385,41,16.54790893,Biore UV Aqua Rich Watery Essence with Micro Defense SPF 50+ PA++++ 15 gram
25386,1,12.10023183,Whitelab Cera-Mug Barrier Moisturizing Gel 20 gram
25390,56,9.867011261,Kahf Trle Action Oil and Comedo Defense Fash Wash 100 ml
25391,47,17.48963283,Kahf Triple Protection Sunscreen Moisturizer SPF 30 PA+++ 30 ml
25397,11,124.0264979,Somethinc Dark Spot Reducer Ampoule 20 ml
25405,43,7.471177205,Rohto Hada Labo Mild Peeling AHA + BHA Face Wash Tube 100 gram
25408,10,4.818159557,Sweety Gold Pants XL44 1 Pack
25409,136,52.33653762,Aveeno Baby Daily Moisture Perawatan Bayi
25410,27,52.70409693,Aveeno Baby Daily Moistur Lotion
25411,41,182.9455924,Aveeno Baby Daily Moisture Kebersihan Bayi 100 ml
25412,58,24.64454774,Aveeno Skin Relief Perawatan Bayi 71 ml
25421,16,132.7306476,Momami Rub A Dub Sun Lotion 50 ml
25426,16,434.1685157,Momami Liquid Talc 125 ml
25427,7,76.22294671,Momami Cutie Facial Cream 50 gram
25428,24,38.22547262,Momami Chubby Bumb Balm 50 gram
25429,1,2.649007331,Momami Pacifier & Bottle Wipes 30 Sheets
25430,44,7.939573574,Momami Saline Wipes 30 Sheets
25431,150,371.3069881,Momami Lovely Baby Cologne Perawatan Bayi 100 ml
25432,7,64.34217313,Momami Sweet Hair Serum 100 ml
25433,7,110.0312289,Momami Toothspray Honeydew 20 ml
25434,17,150.9810519,Momami Toothspray Peach 20 ml
25435,58,19.90053655,Cussons Naturals Kemiri Aloe Seledri Baby Hair Lotion Bottle 100 ml
25436,16,59.65770143,Cussons Kids Shampoo Dragon Fresh & Nourish Sampo Anak 180 ml
25438,24,21.21805981,Marina Natural Rich Moisturizing Lotion 475 ml
25439,7,3.767877012,Marina UV White E Collogen Asta Lotion 185ml 185 ml
25443,13,12.37389644,Pediasure (1-10 Thn) Complete Balance Nutri Vanilla Can 800 ml
25447,219,108.8283743,Eveready Alkaline Max No. 552 AM6 9V Baterai
25471,340,24.36010607,Pond's Vitamin Micellar Water Brightening Rose 100ml 100 ml
25472,13,2.975134348,Wardah Lightening Whip Facial Foam 100 ml
25473,33,6.497021604,Wardah Acnederm Pure Foaming Cleanser Face Wash 50 ml
25479,41,13.73220018,Lifebouy Coconut Fresh Anti Bacterial Body Wash Pouch 400 ml
25483,27,26.01806161,Mitu Wetties Antiseptic Family Wet Wipes Fresh Lemon Bottle 90'S/Tisu Basah Antiseptik
25485,82,1645.862049,Carasun Solar Smart UV Protector SPF 45 PA++++ 70 ml
25486,29,270.7940211,COSRX Aloe Soothing Sun Cream SPF 50+ PA+++ 50 ml
25487,58,1084.81518,COSRX Advanced Snail 96 Mucin Power Essence 100 ml
25492,7,35.88587969,Wardah Lightening Day Cream Step 2 20 ml
25494,96,9.645492218,Wardah Hairfall Threatment Gingseng & Rosemary Shampoo 160 ml
25495,12,187.0151658,Pepsodent Siwak 300 ml
25496,82,21.04284692,Proris Suspensi Rasa Jeruk 60ml / Obat Pereda Demam 60 ml
25500,39,32.18266543,Tempra Paracetamol Rasa Anggur Syrup 30 ml
25501,13,19.83558371,Tempra Syrup 100 ml
25502,15,21.14628292,Actifed Plus Expectorant Sirup Obat Pilek dan Batuk Berdahak 60 ml
25504,90,69.84597996,Mixagrip Flu & Batuk 1strips 1 Strips
25506,34,18.52950667,Cap Lang GPU Liniment Oil 100 ml
25508,20,1.622405312,Stop Kontak 5 LB F1 SNI BLS
25509,71,32.57931373,Panasonic CR2016 Baterai Jam Kancing Cmos
25510,270,227.2841168,Panasonic Prima Leak Proof Biru UM3U Baterai AA 1.5 V  4 pcs
25511,286,119.9316448,Panasonic Neo Extra Longlife Hitam UM3N Baterai AA 1.5 V  4 pcs
25512,154,107.2700273,Panasonic Prima Longlife Biru UM1U D 1.5 V  2pcs 2 pcs
25514,67,121.9618158,Panasonic Neo Longlife Hitam UM1N D 1.5 V  2 pcs
25516,41,49.655414,Panasonic Evolta Premium Alkaline LR03EG Baterai AAA 1.5 V 2 pcs
25518,26,53.74908265,Vape One Push Nyamuk Spray Lemon Can 22 ml
25519,87,1.136534645,Nipis Madu Lime Soda 330 ml
25520,39,4.526098352,Me-O Dry Cat Food Tuna 200gram 200 gram
25522,15,6.368170587,Cesar Prime Beef With Vegetable Dog Food 100gram 100 gram
25524,72,32.84538654,Me-O Creamy Tuna Bonito Makanan Kucing 2 Stick 2 Stick
25526,8,4.331522765,Me-O Creamy Treats Cakalang 60 gram
25528,55,62.77797056,SmartHeart Dry Dog Food Roasted Beef 500 gram
25532,12,3.059940886,SmartHeart Dry Dog Food Lamb & Rice 1500 gram
25534,27,269.5203276,SmartHeart Dry Dog Food Lamb & Rice 500gram 500 gram
25538,15,0.9862050018,SmartHeart Pouch Dog Food Salmon 130gram 130 gram
25541,221,10.46580846,Temptations Savoury Salmon Flavour Cat Treats 75 gram
25543,60,3.989324509,Pedigree Chicken and Grilled Liver Loaf With Vegetables 80gram 80 gram
25545,120,7.615643308,Pedigree Simmered Beef With Vegetables 80gram 80 gram
25548,9,0,Temptations Creamy Purrrr-ee Chicken & Tuna Flavors Makanan Kucing 2 x 12gr 24 gram
25554,133,12.77208294,Makuku SAP Diapers Comfort Fit M28 Pants 1 Pack
25555,154,14.73011373,Makuku SAP Diapers Comfort Fit L26 Pants 1 Pack
25556,130,0,Makuku SAP Diapers Comfort Fit XL24 Pants 1 Pack
25562,45,278.6610561,SGM Eksplor 1 Plus (1-3 Thn) Presinutri Susu Pertumbuhan Vanila  600 gram
25565,139,3093.025864,Pond'S Serum Whip Foam Bright Beauty Facial Foam 100 gram
25566,8,130.4608151,Somethinc Ceramic Skin Saviour Moisturizer Gel Jar 50 ml
25571,12,374.5773506,Somethinc Hyaluronic9+ B5 Serum 40 ml
25577,4,25.54471062,Rohto Hada Labo Ultimate Anti Aging Lotion 100 ml
25578,1,6.362245495,Rohto Hada Labo Gokujyun Premium Ultimate Moisturizing Lotion 100 ml
25579,11,144.1411097,Rohto Hada Labo Ultimate Whitening Lotion 100 ml
25582,40,30.07468775,Zwitsal Kids Bubble Bath Strawberry Strawberry Kebersihan Bayi Pump 280 ml
25587,8,0,Mitu Baby Fresh & Clean Honey Milk 2in1 Liquid Soap 400 ml
25588,13,16.28429273,Mitu Baby Powder Fresh & Clean Pink Floral 150gram 150gram 150 gram
25589,43,92.75454425,Mitu Baby Powder Fresh & Clean Blue Classic 150gram 150gram 150 gram
25591,1,1.17749928,Mitu Baby Cologne Sweet Pink Spray 50ml/Parfum Bayi 50ml 50 ml
25592,18,64.43688521,Mitu Baby Soap 2in1 Honey Bottle 200 ml
25599,108,48.98765868,"Double tape 3m VHB merah-Perekat original 3m 24mm x 4,5mtr"
25603,112,53.09652594,"Double tape 3m VHB merah-Perekat original 3m 12mm x 4,5mtr"
25613,126,39.60488996,Hansaplast Kasa Rol Elastis 1pack 1 Pack
25616,78,9.219174815,Hansaplast Aqua Protect Steril XL 1 Pack
25617,19,4.933089824,Hansaplast Aqua Protect Steril XXL 1 Pack
25618,49,6.906603517,Hansaplast Sensitive Steril XL 1 Pack
25619,92,23.67747143,Hansaplast Sensitive Steril XXL  1 Pack
25638,"12,263",112.1546927,Tissue 2 Ply A Basics 600 gram
25639,"1,877",45.74861875,Kitchen Towel Astro Basics 2 Rolls
25650,84,5.463831042,Oral-B Kids Mickey 2-7 Tahun Toothbrush 1 pcs
25657,240,15.91046159,Baygon Anti Nyamuk Lalat dan Kecoa Flower Garden Can 200ml/Pembasmi Hama 200 ml
25659,92,3.324158988,Olaif Double Seal Ziplock Bag 1.3L (17cmx17cm) 20pcs
25660,60,4.545848358,Olaif Double Seal Ziplock Bag 22 x 22 cm 1.8 L
25661,2,0.4671454094,Olaif Double Seal Ziplock Bag 3.5L (25cmx32cm) 20pcs
25663,1,0.07454671686,Olaif Durable Cleaning Sponge For Dishwashing 3 pcs
25665,8,1.12607979,Olaif Dishwashing Soap Fresh Lime Bottle 800ml
25666,16,19.70460961,Olaif Fresh Lime Cairan Pencuci Piring
25668,112,19.33945814,Olaif Multi-Purpose Microfiber Cloth Abu-abu/Alat Pembersih Rumah 3 pcs
25671,3,0.298400317,Olaif Power Bleach Toilet Cleaner 500ml/Pembersih Kamar Mandi 500ml 500 ml
25673,37,42.54048377,Olaif Powerful Cleaning Liquid Detergent Bottle  1 Liter
25674,326,8.381406516,Olaif Soft Facial Tissue 250 Sheets
25675,19,13.53039978,Olaif Soft Facial Tissue/Tisu Wajah Lembut 900gram 900 gram
25680,13,1.38119144,Olaif 75% Alcohol Wet Wipes 10 Sheets
25681,232,208.9737452,Olaif Antiseptic Wet Wipes 20 Sheets
25683,209,13.42660463,Stella Fresh + Protect Fabric Spray Pink Peony Pengharum Ruangan 200 ml
25685,66,6.901189172,Stella All In One Cafe Latte/Pengharum Ruangan 42 gram
25686,24,3.113504137,Stella All In One Lavender Garden 42+13gr/Pengharum Ruangan
25687,576,9.911642517,Stella Pocket Bathroom Green Apple Pengharum Ruangan 10 gram
25690,201,6.959952441,Downy Pewangi dan Pelembut Pakaian Konsentrat Pashmina Rose 900 ml
25691,438,6.76736342,Downy Premium Cotton Pure Love Pelembut dan Pewangi Pakaian Konsentrat 900 ml
25693,86,4.938070146,Ekonomi Jeruk Nipis Cairan Pencuci Piring 1500 ml
25694,187,6.371511277,Ekonomi Sereh & Jeruk Nipis Cairan Pencuci Piring Pouch 650 ml
25697,1,11.29564504,Sayang Liquid Detergent Original Fresh 800ml
25698,56,100.9174663,Sayang Powder Detergent Original Fresh 770gram 770 gram
25699,16,56.43161892,Sayang 2in1 Deterjen + Softener Romantic Rose Deterjen Cair
25700,42,83.94192955,Sayang Deterjen 2in1 plus Pelembut Original Botol 700ml
25701,20,0.9302399926,Tissue Tessa Facial TV 50s 2P/Tisu Tessa TV Wajah
25702,41,119.951598,Multi Tisu Wajah
25704,12,2.700598831,Tessa Nature Tisu Dapur 2 Rolls
25706,15,24.44891573,Clean Plus Facial Tissue Softpack 180 sheets/ Buy 1 get 1
25707,55,0,Clean Plus Travel Pack Tisu Wajah 70 Sheets
25711,64,9.686116786,Okamoto 003 Platinum Box 10 Sachets
25712,3,2.685959367,Okamoto 003 Platinum Box 3 Sachets
25713,2,1.524880677,Okamoto 003 Aloe Box 3 Sachets
25714,29,19.76478001,Okamoto Crown Super Thin & Soft Box 10 Sachets
25715,15,5.075124316,Okamoto Harmony Vibra Ribbed Box 3 Sachets
25716,1,0.3679941864,Okamoto 003 Cool Box/Kondom 3 Sachets
25717,999,40.75047983,Extra Virgin Coconut Oil Astro Goods 100 ml
25719,"1,977",663.4065826,Pasir Kucing Scented A Basics 2000 gram
25740,16,34.69435004,Super Ester-C Botol 90 Tablet
25741,138,7.495864335,Nuvo Tisu Basah Antiseptik Merah 50'S/Tisu Basah Antiseptik 50 Sheets
25742,61,23.912265,Nuvo Tisu Basah Antiseptik Biru 50'S/Tisu Basah Antiseptik 50sheets 50 Sheets
25743,215,54.74825043,Clean Plus Bamboo Travel Pack Tisu Wajah 70 Sheets
25744,52,5.57567707,Clean Plus Bamboo Soft Pack Facial Tissue 150 Sheets/Tisu Wajah 150sheets 150 Sheets
25745,46,49.75541805,Bagus Jumbo With Case/Kapur Barus
25746,17,11.82163974,Bagus Jumbo Refill/Kapur Barus
25747,2,0.78234403,Bagus Kapur Ajaib/Kapur Barus 6pcs 6 pcs
25750,5,3.844118539,Bagus Anti Bau Gel Lemari Es 180gr/Kapur Barus 180 gram
25751,3,2.55912342,Bagus Anti Bau Mobil 100gr/Kapur Barus 100 gram
25752,21,18.20838471,Mr. Bagus Magic Sponge 1'S
25753,13,2.802434632,Bagus Sabut Spons Multipurpose Tipe 556 3'S
25754,71,7.601985079,Bagus Zipperbag 18cmx23cm 20'S
25755,134,7.519195188,Bagus Zipperbag 27cmx28cm 20'S
25756,24,6.947264974,Bagus Sikat Sapu Lantai Tipe 327/Alat Pembersih 1 pcs
25757,10,54.3221224,Bagus Fresh99 Premium Anti Bacterial Dish Washing Liquid Fresh Lime Botol  600ml 600 ml
25761,1,3.110718149,Bagus Fresh Luwak Coffee Pengharum Ruangan 50 gram
25763,46,24.08579251,Ciptadent Toothpaste Shiny White 190 gram
25765,20,22.16692237,Pantene Pro-V Anti Lepek Shampoo 750 ml
25769,103,7.788355947,Nuvo Family Mild Protect Body Wash Refill 825 ml
25775,44,8.82621468,Giv White Hijab Saffron & Niacinamide Body Wash Refill 400 ml
25776,3,1.328438719,Giv Passion Flowers & Sweet Berry Body Wash Refill 60 ml
25778,51,26.40709064,Giv White Pure White Bengkoang & Yogurt Body Wash Refill 60 ml
25779,42,30.42650219,Ciptadent Diamond Clean Soft Sikat Gigi 1 pcs
25780,71,121.5371289,Gillete Mach 3 Triple Cartridge 2pcs 1 Pack
25784,17,103.5925765,My Baby Hair & Body Wash Sweet Floral Liquid Bottle 200 ml
25785,32,5.874287466,B&B Kids Hair & Body Wash Smooth Protection My Little Pony Pinkie Pie 280 ml
25786,27,13.02492505,B&B Kids Hair & Body Wash Clean Nourishing My Little Pony Rainbow Dash 280 ml
25787,15,0.5342276717,Paramex 1strips 1 Strips
25790,1,32.95598197,Sebamed Clear Face Deep Cleanser Face Toner Bottle 150 ml
25792,16,106.0719482,Sebamed Baby Bubble Bath Sabun Bayi 1000 ml
25794,9,34.04384301,Sebamed Baby Children's Shampoo Shampo Anak 250 ml
25796,5,5.160280859,Inza 1strips 1 Strips
25801,108,66.54142664,Nuvo Barsoap Family Toska 76 gram
25803,12,32.26763919,Giv Hijab Barsoap Tin & Zaitun 76 gram
25805,117,64.26877612,Ciptadent Toothbrush Classic Double Action Soft 1pcs 1pcs 1 pcs
25806,57,24.40813048,K Natural Bodywash White Aloe Vera Bottle 500 ml
25835,41,509.4760015,Sea-Quill Vitamin E 400 IU Softgel 30 Tablet
25844,324,44.08884603,Deterjen Cair Konsentrat Professional Pink Peony Astro Basics 4000 ml
25845,"2,329",78.12745281,Deterjen Cair Matic Professional Fresh Linen Astro Basics 4000 ml
25846,635,62.51394562,Pelembut dan Pewangi Pakaian Spring Blossom Astro Basics 4000 ml
25847,187,11.86596297,"CESAR Naturally Crafted Chicken, Sweet Potato & Green Bean Wet Dog Food 60 gram"
25848,42,1.755363983,"CESAR Naturally Crafted Chicken, Pumpkin & Carrot Wet Dog Food 60 gram"
25850,166,10.60464155,"CESAR Naturally Crafted Chicken, Beef & Green Bean Wet Dog Food 60 gram"
25851,35,2.124426823,"CESAR Naturally Crafted Lamb, Carrot & Sweet Potato Wet Dog Food 60 gram"
25857,750,8.194549905,Ritz Cokelat Biskuit Sandwich 91 gram
25868,6,6.062783046,Bayfresh Aerosol Strawberry Bubblegum 320ml/Pengharum Ruangan 320 ml
25871,19,8.179161906,Bayfresh Reed Diffuser Refill Pengharum Ruangan Morning Coffee/Pengharum Ruangan
25872,10,12.85150689,Bayfresh Reed Diffuser Morning Coffee Pengharum Ruangan Set
25874,6,0,Bayfresh Reed Diffuser Device Pengharum Ruangan Mint Eucalyptus/Pengharum Ruangan 1 pcs
25878,12,0,Glade Diamond Spring Apple Pengharum Mobil Refill 80 ml
25879,16,83.74275551,Glade Diamond Wild Berries Refill 80ml/Pengharum Ruangan 80 ml
25880,4,7.352184103,Glade One For All Pengharum Ruangan Ocean Escape/Pengharum Ruangan 70 gram
25881,21,7.085571564,Glade One For All Air Freshener Vanilla & Oudwood Refill 70gr/Pengharum Ruangan 70gram 70 gram
25886,41,30.14902586,Windex Liquid Pembersih Kaca Fresh Pouch 400ml/Pembersih Kaca 400 ml
25894,"1,246",103.4724718,Pembersih Lantai Fresh Apple Astro Basics 4000 ml
25895,415,374.8449094,Karbol Wangi Classic Pine Astro Basics 4000 ml
25915,1,0,#N/A
25916,55,79.3056936,Bio Creamy Salmon 4pcs x 15gr 4 Stick
25917,7,13.61151802,Bio Creamy Chicken With Tuna 4pcs x 15gr 60 gram
25918,55,29.94442932,Life Cat Salmon Adult Pouch 85gram 85 gram
25919,97,28.62079643,Life Cat Salmon Kitten Pouch 85gram 85 gram
25920,42,134.4544754,Life Cat Salmon Kitten kaleng 400gram 400 gram
25921,84,116.2197171,Life Cat Chicken and Salmon Adult kaleng 400gram 400 gram
25923,145,9.015867404,Life Cat Tuna Kitten Can 400gram 400 gram
25925,31,45.70819813,Sakura Para Kamper Kapur Barus 150 gram
25926,133,7.34074297,Swallow Jumbo Naphthalene Ball 5's 150gr/Kapur Barus
25927,7,19.74669922,Rakuzen Premium Drawstring Bag Kantong Sampah Plastik Dengan Tali 45cm x 50cm
25928,2,2.432105955,Rakuzen Premium Drawstring Bag Kantong Sampah Plastik Dengan Tali 50cm x 55cm
25929,10,21.0401835,Rakuzen Premium Plastic Bag Kantong Sampah Sakura Edition 45cm x 50cm
25931,59,40.65426626,Bagus Fancy Rose 60gram 60 gram
25932,46,49.49828319,Bagus Para Hanger 200gr/Kapur Barus 200 gram
25933,10,14.3661002,Swan Twin Ball Kapur Barus 2 pcs
25934,9,11.25101628,Swallow My Flower Lavender/Kapur Barus
25935,18,32.55698167,Swallow Twin Ball Kapur Barus 2 pcs
25939,2,1.676028032,Bagus Kantong Sampah XL 6 Putih Uk. 90cm x 100cm
25943,2,13.31562255,Bagus Aluminium Foil Box 45cm x 7.62m
25944,10,29.39148427,Bagus Aluminium Foil Refill 45cm x 7.62m
25945,4,17.91041728,Bagus Cling Wrap Refill 30cm x 45m
25946,14,13.21884795,Bagus Cling Wrap Box 30cm x 20m
25947,72,7.709055291,Bagus Zipperbag With Pouch 25's 18cm x 18cm
25948,50,5.353510619,Bagus Zipperbag With Pouch 20's 18.5cm x 23.5cm
25949,31,3.319176584,Bagus Easy Zipperbag 25's 20cm x 20cm
25950,12,25.44643806,Bagus Easy Zipperbag 15's 27cm x 28cm
25953,14,53.93581045,Bagus Fresh99 Premium Anti Bacterial Dish Washing Liquid Fresh Lime Pouch 575 ml
25955,15,8.128680448,Kispray Elegant Sapphire Botol 318ml
25956,4,0.668048548,Kispray Saphire Dus 8ml 8 ml
25957,62,3.439964047,Jolly Facial Kiloan 560gr/Tisu Wajah 560 gram
25958,132,35.34989076,Jolly Pop Up Tisu Wajah 90 gram
25993,23,20.54900344,Banana Boat Sport Sunscreen Lotion SPF 30 Tube 90 ml
25994,4,3.31900808,Banana Boat Sun Comfort Sunscreen Lotion SPF 50 PA+++ 90 ml
25999,209,122.3959277,Pita Kado Serut Kecil isi - Astro Basics 1 Pack
26000,485,466.4145681,Pita Satin Gulung Merah A Basics 1 pcs
26001,28,22.1528534,Pita Satin Gulung Silver A Basics 1 pcs
26002,610,785.3570226,Pita Satin Gulung Gold A Basics 1 pcs
26003,173,149.637637,Tali Goni Gulung A Basics 5m 1 pcs
26005,361,0,#N/A
26006,"2,942",72.72758306,Toilet Tissue 2 Ply A Basics 10 Rolls
26008,383,58.85022841,Pembersih Kamar Mandi Astro Basics 800 ml
26011,177,14.08870146,Olaif Powerful Cleaning Deterjen Cair 1 Liter
26052,1,16.67054494,S-26 Procal 3 Susu Pertumbuhan Vanila 1-3 Tahun Box 1.4 Kg
26062,3,0,#N/A
26064,31,0,#N/A
26065,34,60.27035934,Yuri Bleach Penghilang Noda Morning Fresh Botol  1 Liter
26066,5,33.44033618,Yuri Aganol Pembersih Lantai Lemon Fresh Botol 1L/Pembersih Lantai 1 Liter
26067,120,415.9724489,Yuri Bleach Penghilang Noda Lemon Fresh Botol  1liter 1 Liter
26068,12,12.59056785,Yuri Biosoft Deterjen Cair Pouch 250ml
26069,8,65.25838435,Yuri Glass Cleaner Foam Lemon Fresh Botol Spray 500ml/Pembersih Kaca 500ml 500 ml
26070,19,34.00201933,Yuri Tril Pelicin Pakaian Floral Rose Pink Pouch 410ml
26072,1,6.163737623,Yuri Tril Pelicin Pakaian Lavender Botol 500ml
26073,1,0.9574558906,Yuri Taf Kitchen Cleaner Pouch 375ml/Pembersih Lainnya 375ml 375ml 375 ml
26077,37,0,Vape Aerosol Fruity Fresh/Pembasmi Hama 600ml 600 ml
26089,33,0,Casa Grata Herbs Crackers 70 gram
26091,230,5.796407501,Kobe Bumbu Nasi Uduk 45gr 3 pcs
26092,246,8.21558196,Kobe Bumbu Nasi Kuning 45gr 3 pcs
26098,15,18.07489182,ABC Saus Tomat 275 ml
26100,103,17.56578025,Haidilao Hot Pot Sauce Shrimp Bumbu Steamboat 200 gram
26104,10,21.81267208,Pronas Tuna Chunk In Brine 185 gram
26107,16,0.8550986774,Finna Sambal Uleg Terasi 18gr 10sachets 10 Sachets
26109,22,2.913450201,Finna Sambal Uleg Rawit Sachet 10 x 18gr/Sambel
26111,6,8.4655537,Finna Saus Dipping 340ml 340 ml
26112,65,4.030032212,Finna Kecap Ikan Cap King Lobster 200ml 200 ml
26114,1,1.131102286,Finna Sambal Uleg Rawit 180gram 180 gram
26115,7,5.795602689,Finna Kerupuk Intan 8x5 400 gram
26127,28,56.13548605,WRP Meal Replacement Chocolate Suplemen Box 6 Sachets
26128,6,10.72435614,WRP Diet Tea Suplemen Box 10 Sachets
26137,84,10.68856367,Good Time Mini Double Choc Chocochip Cookies 50 gram
26174,493,25.46447396,Foom Liquid Icy Watermelon Rokok Elektrik 30 ml
26176,813,0,Foom Liquid Icy Berry Rokok Elektrik  30 ml
26183,156,3.07154861,Foom Refillable Cartridge Pod X Pack Rokok Elektrik 3pcs 1 Pack
26184,733,20.05176457,Foom Liquid Icy Menthol Rokok Elektrik  30 ml
26217,992,24.46504045,Foom Liquid Iced Tea Rokok Elektrik  30 ml
26223,"1,299",0,#N/A
26224,2,0,#N/A
26225,75,5.447895787,Mujigae by Wonhae Banana Milk Strawberry Susu UHT 250 ml
26246,"1,594",274.2161256,Pembersih Kaca Astro Basics 500 ml
26256,10,12.60779366,Rakuzen Premium Trash Bag Black 45cm x 50cm 
26263,269,22.31658051,Bola Deli Tepung Maizena 500 gram
26281,12,149.6324587,Bukrim Oxyklin Liquid Deterjen Violet Scent 750ml 750 ml
26284,2,2.016356107,Sparkle Karbol Pine Pembersih Lantai Pouch 800ml 800 ml
26286,52,31.14206436,Klarens General Cleaning Wipes Calming Musk/Tisu Basah
26287,29,29.17143347,Klarens General Cleaning Wipes Pink Rose/Tisu Basah
26288,81,51.20900036,Klarens General Cleaning Wipes Sweet Honeydew/Tisu Basah
26289,57,27.46350947,Kleenex Facial Tissue Brazilian Citrus Sensation 3 Ply 44 sheets 44 Sheets
26291,3,28.39719703,Ambipur Pengharum Mobil Aqua Refill 7.5ml/Pengharum Mobil
26292,8,16.69046692,Ambipur Pengharum Mobil Aqua Starter Kit Ultra 7.5ml/Pengharum Mobil
26293,9,34.42831504,Ambipur Pengharum Mobil Fresh And Cool 7.5ml/Pengharum Mobil
26295,2,3.185456052,Ambipur Pengharum Mobil Fresh And Light Refill 7.5ml/Pengharum Mobil
26298,4,12.12073111,Ambipur Pengharum Mobil Lavender Spa Starter Kit Ultra 7.5ml/Pengharum Mobil
26306,61,22.82897533,Molto Parfum Boost Fresh Casablanca Lily Pelembut & Pewangi Pakaian 650 ml
26308,41,3.107042638,Molto Pelembut Dan Pewangi Parfum Boost Japanese Peach 650ml
26311,41,14.06762066,Morning Fresh Dish Wash Liquid Lemon 400ml
26313,1,3.388710524,Gillette Fusion Proglide Blades S.Cartr Cardpack 2pcs 1 Pack
26315,28,4.432395176,Biore Body Foam Relaxing Aromatic Pump Bottle 550 ml
26317,87,41.91798815,Laurier Healthy Skin Night Wing Polybag 8pcs 1pack 1 Pack
26318,35,3.37271169,Laurier Pantyliner Safety Long Non Perfumed isi 40 pcs 1 Pack
26319,67,2.120041802,Laurier Healthy Skin Day Wing 22cm Pembalut Wanita 9 pcs
26320,32,15.41811058,Laurier Relax Night Celana Menstruasi Size S-M 2 pcs
26321,12,1.226504876,Laurier Pantyliner Natural Clean Perfumed Regular 40pcs 1pack 1 Pack
26322,46,2.702602156,Laurier Relax Night Gathers Wing 40cm Pembalut Wanita 16 pcs
26323,102,11.2920142,Laurier Natural Clean Night Wing 35cm 12pcs 12 pcs
26326,13,14.13531739,Sagami Original 0.01 Box/Kondom 5 Sachets
26327,84,40.44035342,Sagami Xtreme Superthin/Kondom 3 Sachets
26330,41,173.6942117,Sagami Xtreme Dotty G Mint 3 Sachets
26332,36,47.01666514,Moist Diane Extra Smooth & Straight Shampoo Pump 450 ml
26333,15,13.19599378,Moist Diane Extra Vital Shampoo Pump 450 ml
26334,6,8.028824759,Sutra Ok Box 12 Sachets
26336,36,200.9814912,Fiesta Grape Imp Box 3 Sachets
26337,2,49.48920808,Fiesta Black Coffee Imp Box 3 Sachets
26338,3,22.44224044,Fiesta Bubble Gum Imp Box 3 Sachets
26339,23,11.08176698,Fiesta Max Dotted Imp Box 12 Sachets
26340,26,231.3955642,Fiesta Watermelon Sugar Imp Box 3 Sachets
26344,54,33.335721,NIVEA Body Lotion Extra Bright Repair & Protect SPF15 380 ml
26348,42,20.59483085,Nivea Extra White Night Nourish Deep White Ess Body Lotion Bottle 200ml 200 ml
26361,2,15.98637069,Pigeon Peristaltic Nipple Slim Neck Nursing Bottle Bottle 240 ml
26363,6,98.19925139,Pigeon Peristaltic Nipple Nursing Bottle Bottle 120ml 120 ml
